title,type_job,salary,compagny,location,region,departement,latitude,longitude,language,skills,date,description,tokens,source
Data engineer,CDI  ,60000.0,VR CONSEIL,Paris 09 - 75,Île-de-France,Paris,48.8534951,2.3483915,Minimum 5 ans,skills,14/12/2023,"Auprès d'un de nos clients dans l'univers de la Finance de Marché, vous interviendrez en tant que data engineer ou data analyst. Dans ce cadre, vos principales missions seront les suivantes :Comprendre les besoins des utilisateurs et les traduire de manière analytiqueIdentifier, collecter, stocker et analyser les données.Développer des algorithmes permettant de répondre aux problèmes posés et veiller à leur industrialisationExtraction des données massives brutesConstruire des bases de données robustesConcevoir les moyens de communication et réaliser des reportingsAlteryx, MSBI, Bigdata, Spark scala, Datalake, Talend,... Auprès d'un de nos clients dans l'univers de la Finance de Marché, vous interviendrez en tant que data engineer ou data analyst. Dans ce cadre, vos principales missions seront les suivantes : Comprendre les besoins des utilisateurs et les traduire de manière analytique Identifier, collecter, stocker et analyser les données. Développer des algorithmes permettant de répondre aux problèmes posés et veiller à leur industrialisation Extraction des données massives brutes Construire des bases de données robustes Concevoir les moyens de communication et réaliser des reportings Alteryx, MSBI, Bigdata, Spark scala, Datalake, Talend,... De formation supérieure Bac+ 4/5, vous justifiez d'expériences significatives (minimum 5 ans) en tant que Data Engineer ou Data Analyst.Dynamisme, rigueur, capacité d adaptation et d'intégration ainsi que votre esprit d""équipe et vos qualités humaines seront vos meilleurs atouts.Pourquoi nous rejoindre ?ESN à taille humaine, nous accordons une place centrale au suivi et à l'accompagnement de nos consultants,Nous ne proposons que des missions de longue durée,Nous sommes spécialisés en Finance : un secteur innovant et exigeant qui vous permettra d'évoluer au sein d'équipes performante.,Et bien sûr des équipes à l'écoute et conviviales que vous serez heureux de retrouver ! De formation supérieure Bac+ 4/5, vous justifiez d'expériences significatives (minimum 5 ans) en tant que Data Engineer ou Data Analyst. Dynamisme, rigueur, capacité d adaptation et d'intégration ainsi que votre esprit d""équipe et vos qualités humaines seront vos meilleurs atouts. Pourquoi nous rejoindre ? ESN à taille humaine, nous accordons une place centrale au suivi et à l'accompagnement de nos consultants, Nous ne proposons que des missions de longue durée, Nous sommes spécialisés en Finance : un secteur innovant et exigeant qui vous permettra d'évoluer au sein d'équipes performante., Et bien sûr des équipes à l'écoute et conviviales que vous serez heureux de retrouver ! Aucune langue attendue Aucun savoir-être attendu Aucun savoir-faire attendu Créée en 2004, VR Conseil est une ESN spécialisée dans les métiers de la Finance de Marché.Afin d'accompagner efficacement ses clients dans leurs projets, VR Conseil s'est organisé en deux pôles de compétences : le pôle « Ingénierie Logicielle/MOE » et le pôle « Conseil/MOA ».Aujourd'hui VR Conseil compte une centaine de consultants à double compétence informatique et financière. Reconnu comme acteur de référence chez les majeurs de la Finance, VR Conseil participe au quotidien à la croissance de ses clients. Créée en 2004, VR Conseil est une ESN spécialisée dans les métiers de la Finance de Marché.Afin d'accompagner efficacement ses clients dans leurs projets, VR Conseil s'est organisé en deux pôles de compétences : le pôle « Ingénierie Logicielle/MOE » et le pôle « Conseil/MOA ».Aujourd'hui VR Conseil compte une centaine de consultants à double compétence informatique et financière. Reconnu comme acteur de référence chez les majeurs de la Finance, VR Conseil participe au quotidien à la croissance de ses clients. Personne en charge du recrutement Ben Diomandé - consultant en recrutement ",auprès client finance marché interviendrez tant data engineer data analyst cadre principales mission suivantes comprendre besoins utilisateurs traduire manière analytiqueidentifier collecter stocker analyser algorithmes permettant répondre problèmes posés veiller industrialisationextraction données massif brutesconstruire base données robustesconcevoir moyens communication réaliser reportingsalteryx msbi bigdata spark scala datalake talend auprès client finance marché interviendrez tant data engineer data analyst cadre principales mission suivantes comprendre besoins utilisateurs traduire manière analytique identifier collecter stocker analyser données développer algorithmes permettant répondre problèmes posés veiller industrialisation extraction données massif brute construire base données robustes concevoir moyens communication réaliser reporting alteryx msbi bigdata spark scala datalake talend formation supérieure justifiez significatives minimum an tant data engineer data rigueur capacité adaptation ainsi esprit équipe qualités humaines meilleurs rejoindre esn taille humaine accordons place centrale suivi consultant proposons mission longue durée spécialisés finance secteur innovant exigeant permettra sein bien sûr équipes conviviales heureux retrouver formation supérieure justifiez significatives minimum an tant data engineer data analyst dynamisme rigueur capacité adaptation ainsi esprit équipe qualités humaines meilleurs atouts pourquoi rejoindre esn taille humaine accordons place centrale suivi consultant proposons mission longue durée spécialisés finance secteur innovant exigeant permettra sein bien sûr équipes conviviales heureux retrouver aucune langue attendue aucun attendu aucun attendu créée vr conseil esn spécialisée métiers finance efficacement client leurs projets vr conseil organisé deux pôles compétences pôle ingénierie pôle vr conseil compte centaine consultant double compétence informatique financière reconnu comme acteur référence chez majeurs finance vr conseil participe quotidien croissance client créée vr conseil esn spécialisée métiers finance efficacement client leurs projets vr conseil organisé deux pôles compétences pôle ingénierie pôle vr conseil compte centaine consultant double compétence informatique financière reconnu comme acteur référence chez majeurs finance vr conseil participe quotidien croissance client personne charge recrutement ben diomandé consultant recrutement,Apec
Data analyst,CDI  ,40000.0,ARCHERY DATA & ANALYTICS,Tours - 37,Centre-Val de Loire,Cher,47.234135,2.0371709,Minimum 5 ans,skills,02/11/2023,"Archery Data & Analytics recherche pour son cabinet de Tours un.e data analyst/engineer confirmé afin de renforcer son équipe actuelle. Dotée d'une expertise reconnue, d'une autonomie et d'un bon relationnelle, vous collaborerez avec les autres consultants ainsi que nos clients.  Environnement de travail (principal/secondaire) : Fonctionnel : Industrie, logistique et fonctions transverses Plateformes Cloud: Microsoft AZURE/Google Cloud Platform Plateformes Data Onpremise: SQL Server Suite Outils de Reporting : Microsoft Power BI/Qlicksense Plateformes d intégration: SQL Integration Services (SSIS) et Azure Data Factory (ADF) Langages de programmation : SQL, DAX, M  Missions :  Apporter conseils et expertises à nos clients lors des missions Data. Concevoir, développer et mettre en place des solutions Data & Analytics de bout en bout : Participer à la captation et l analyse des besoins de nos clients avec l aide de nos consultants Data. Rédiger les cahiers des charges et les spécifications fonctionnelles pour formaliser les besoins de nos clients. Concevoir les solutions à mettre en œuvre de façon à répondre aux exigences et attentes des utilisateurs. Contribuer à la conception, puis à la mise en place des infrastructures que ce soit en IaaS, SaaS ou PaaS  Concevoir et mettre en place des flux de données automatisés, des modèles de données   Concevoir et développer des reporting d aide à la décision (calculs complexes et algorithmes inclus). Documenter les solutions développées et en assurer le maintien en conditions opérationnelles (MCO). Assurer le suivi du projet et la relation avec le client final. Participer aux projets de développements de produits internes du cabinet Archery.  Participer à la dynamique commerciale de l entreprise Assurer la veille technologique et contribuer à étendre nos expertises.  Archery Data & Analytics recherche pour son cabinet de Tours un.e data analyst/engineer confirmé afin de renforcer son équipe actuelle. Dotée d'une expertise reconnue, d'une autonomie et d'un bon relationnelle, vous collaborerez avec les autres consultants ainsi que nos clients.    Environnement de travail (principal/secondaire) :    Missions :   Profil recherché et informations générales sur le poste : 5 ans min d expérience sur un poste similaire idéalement dans une DSI ou ESN Être autonome, rigoureux, force de proposition, pédagogue et avoir un très bon relationnel Soif d apprendre et à l aise dans l apprentissage de nouvelles technologies ou outils. Maitriser de la conduite de projet et de l animation de ses instances Parler Anglais de manière professionnelle  Profil recherché et informations générales sur le poste :  Anglais B2 Autonomie Capacité d'apprentissage Voir plus Analyse des besoins clientèle Minimum 5 ans d’expérience Gestion de projet Minimum 5 ans d’expérience Voir plus Archery Data & Analytics est un cabinet d expertise Data ; filiale d Archery Strategy Consulting, cabinet de conseil en direction générale. Notre Groupe est spécialisé dans 3 secteurs : aéronautique/spatial/défense, transports/logistique et énergie. Nous intervenons chez nos clients sur des problématiques : De stratégie et de transformation data/digitale (gouvernance des données, roadmap data, audit ) De maîtrise d œuvre et gestion de projets Data à forts enjeux (utilisation des méthodes Agiles, Scrum, DevOps ) De réalisation de projets Data & Analytics (Business Intelligence, MDM, BIG DATA, Data Sciences, Low Coding ) Nous développons et commercialisons également des solutions métiers à haute valeur ajoutée (ingénierie, gestion de projets, outils grands programmes, suivi de production, maintenance ). Constitué en 2021, le cabinet est aujourd hui représenté par 13 consultants Data & Analytics répartis sur nos sites de Tours, Paris et Toulouse.  Nous sommes aujourd hui à la recherche d un Data Engineer/Analyst expérimenté pour notre bureau de Tours.  Archery Data & Analytics est un cabinet d expertise Data ; filiale d Archery Strategy Consulting, cabinet de conseil en direction générale. Notre Groupe est spécialisé dans 3 secteurs : aéronautique/spatial/défense, transports/logistique et énergie.  Nous intervenons chez nos clients sur des problématiques :  Nous développons et commercialisons également des solutions métiers à haute valeur ajoutée (ingénierie, gestion de projets, outils grands programmes, suivi de production, maintenance ).  Constitué en 2021, le cabinet est aujourd hui représenté par 13 consultants Data & Analytics répartis sur nos sites de Tours, Paris et Toulouse.  Nous sommes aujourd hui à la recherche d un Data Engineer/Analyst expérimenté pour notre bureau de Tours.  Personne en charge du recrutement Meghann Gautier - Chargée des Ressources Humaines ",archery data analytics recherche cabinet tour data confirmé afin renforcer équipe actuelle dotée expertise reconnue autonomie bon relationnelle collaborerez autres consultant ainsi client environnement travail fonctionnel industrie logistique fonctions transverses plateformes cloud microsoft cloud platform plateformes data onpremise sql server suite outils reporting microsoft power plateformes intégration sql integration service ssis azure data factory adf langages programmation sql dax mission apporter conseils expertise client lors mission data concevoir développer mettre place solution data analytics bout bout participer captation analyse besoins client aide consultant data rédiger cahiers charge spécifications fonctionnelles formaliser besoins client concevoir solution mettre œuvre façon répondre exigences attentes utilisateurs contribuer conception puis mise place infrastructure iaa saas paas concevoir mettre place flux données automatisés modèles données concevoir développer reporting aide décision calculs complex algorithmes inclus documenter solution développées assurer maintien condition opérationnelles mco assurer suivi projet relation client final participer projets développements produits interne cabinet archery participer dynamique commerciale entreprise assurer veille technologique contribuer étendre expertise archery data analytics recherche cabinet tour data confirmé afin renforcer équipe actuelle dotée expertise reconnue autonomie bon relationnelle collaborerez autres consultant ainsi client environnement travail mission profil recherché information générales poste an min expérience poste similaire idéalement dsi esn être autonome rigoureux force proposition pédagogue avoir très bon relationnel soif apprendre aise apprentissage nouvelles technology outils maitriser conduite projet animation instance parler anglais manière professionnelle profil recherché information générales poste anglais autonomie capacité voir plus analyse besoins clientèle minimum an expérience gestion projet minimum an expérience voir plus archery data analytics cabinet expertise data filiale archery strategy consulting cabinet conseil direction générale groupe spécialisé secteurs énergie intervenons chez client problématiques stratégie transformation gouvernance données roadmap data audit maîtrise œuvre gestion projets data fort enjeux utilisation méthodes agiles scrum devops réalisation projets data analytics business intelligence mdm big data data science low coding développons commercialisons également solution métiers haute valeur ajoutée ingénierie gestion projets outils grand programme suivi production maintenance constitué cabinet aujourd hui représenté consultant data analytics répartis site tour paris toulouse aujourd hui recherche data expérimenté bureau tour archery data analytics cabinet expertise data filiale archery strategy consulting cabinet conseil direction générale groupe spécialisé secteurs énergie intervenons chez client problématiques développons commercialisons également solution métiers haute valeur ajoutée ingénierie gestion projets outils grand programme suivi production maintenance constitué cabinet aujourd hui représenté consultant data analytics répartis site tour paris toulouse aujourd hui recherche data expérimenté bureau tour personne charge recrutement meghann gautier chargée ressources humaines,Apec
