title,type_job,salary,compagny,location,region,departement,latitude,longitude,language,skills,date,description,tokens,source
Data analyst,CDI  ,,,Saint-Ouen - 93,Hauts-de-France,Somme,50.03683,2.1223737,Tous niveaux d'expérience acceptés,skills,28/12/2023,"Les missions du Data Analyst sont variées :Recueil et extraction des sources de données pertinentes et de qualité qu'il traduit ensuite en données statistiques ;Traitement, exploitation et intégration des données dans un data warehouse (entrepôt de données) ;Création de dashboards, mise en place de KPIs et reporting des performances pour donner une vision cohérente des résultats aux différentes équipes ;Mise en place de process/requêtes et automatisation ;Production d'analyses métiers et de recommandations aux managers ;Gestion des outils d'analyses pour que les décideurs internes et les clients puissent suivre l'évolution de leurs produits ;Veille technologique des nouveaux outils visant à l'améliorer l'analyse des données. Le Data Analyst possède des compétences techniques avec la maîtrise de divers outils et logiciels (Excel, Web Analytics, BI, SAS, VBA, Python etc.), ainsi que des langages de programmation tel que R. Il doit à la fois faire preuve d'une grande aisance rédactionnelle et avoir une passion pour les chiffres et les statistiques. Son orientation business et son aisance relationnelle avec les métiers lui permettent de réaliser des recommandations pertinentes et de simplifier les problématiques techniques. Rigoureux, organisé, réactif et d'esprit analytique, le Data Analyst pourra ainsi être capable d'apporter une vision cohérente des tendances d'activité de l'entrepris Aucune langue attendue Capacité d'analyse Proactivité Voir plus Informatique décisionnelle Minimum 5 ans d’expérience Langage de programmation Minimum 5 ans d’expérience Voir plus Nous sommes une ESN agile, un groupe international certifié Top Employer Europe 2023.A l'ère de la post-transformation digitale, nous mettons tout en oeuvre pour que chacun de nos 27 000 athlètes du digital puisse se renouveler perpétuellement, en vivant positivement son propre flow digital.Chacun de nos talents peut ainsi façonner son parcours de carrière selon ses appétences, entreprendre de manière pragmatique avec ses clients pour un monde à impact positif, innover localement dans 27 pays et harmoniser son investissement professionnel et son bien-être personnel.Rejoignez Inetum. Live your positive digital flow.Tous nos postes sont ouverts aux personnes en situation de handicap. ",mission data analyst variées recueil extraction source données pertinentes qualité traduit ensuite données statistiques traitement exploitation intégration données data warehouse entrepôt données création dashboard mise place kpis reporting performance donner vision cohérente résultats différentes équipes mise place automatisation production métiers recommandations manager gestion outils décideurs interne client puissent suivre leurs produits veille technologique nouveaux outils visant données data analyst possède compétences technique maîtrise diver outils logiciels excel web analytics bi sa vba python etc ainsi langages programmation tel doit fois faire preuve grande aisance rédactionnelle avoir passion chiffres statistiques orientation business aisance relationnelle métiers permettent réaliser recommandations pertinentes simplifier problématiques technique rigoureux organisé réactif analytique data analyst pourra ainsi être capable vision cohérente tendances aucune langue attendue capacité proactivité voir plus informatique décisionnelle minimum an expérience langage programmation minimum an expérience voir plus esn agile groupe international certifié top employer europe digitale mettons tout oeuvre chacun athlètes digital puisse renouveler perpétuellement vivant positivement propre flow talent peut ainsi façonner parcours carrière selon appétences entreprendre manière pragmatique client monde impact positif innover localement pay harmoniser investissement professionnel inetum live your positive digital postes ouverts personnes situation handicap,Apec
Data analyst,CDI  ,39000.0,SII,Lille - 59,Bourgogne-Franche-Comté,Saône-et-Loire,46.6909143,4.357453,Minimum 2 ans,skills,11/12/2023,"Devenez le prochain collaborateur d'SII Nord, en tant que : Data analyst (H/F)En intégrant l’équipe data de l'un de nos client, les missions qui vous sont confiées sont :•    D’aider à la conception des modèles de données•    D’optimiser/améliorer le reporting existant•    D’aider sur le calcul des KPI•    D’optimiser les requêtes •    De participer aux divers projets liés à la data (développement d’algorithme, croisement de données etc.) Devenez le prochain collaborateur d'SII Nord, en tant que : Data analyst (H/F)En intégrant l’équipe data de l'un de nos client, les missions qui vous sont confiées sont : •    D’aider à la conception des modèles de données•    D’optimiser/améliorer le reporting existant•    D’aider sur le calcul des KPI•    D’optimiser les requêtes •    De participer aux divers projets liés à la data (développement d’algorithme, croisement de données etc.) Dans l’idéal (oui uniquement dans l’idéal, chez nous on ne cherche pas qu’un CV mais une collaboration durable), vous êtes issu d’une formation supérieure Bac +5 et vous justifiez d’une expérience de 2 ans  min sur un poste de Data Analyst. BigQuery, PowerBI ou encore GCP n’ont plus de secret pour vous. Au-delà des compétences techniques, vous êtes/avez : •    Rigoureux : chaque détail a son importance •    Curieux : Désireux de connaître le « pourquoi » et le « comment » •    Organisé : chaque journée commence par une « To do » •    Sens du service : la satisfaction client est votre objectif premier Ces qualités vous permettent de mener à bien le projet.  Dans l’idéal (oui uniquement dans l’idéal, chez nous on ne cherche pas qu’un CV mais une collaboration durable), vous êtes issu d’une formation supérieure Bac +5 et vous justifiez d’une expérience de 2 ans  min sur un poste de Data Analyst. BigQuery, PowerBI ou encore GCP n’ont plus de secret pour vous.  Au-delà des compétences techniques, vous êtes/avez : •    Rigoureux : chaque détail a son importance •    Curieux : Désireux de connaître le « pourquoi » et le « comment » •    Organisé : chaque journée commence par une « To do » •    Sens du service : la satisfaction client est votre objectif premier Ces qualités vous permettent de mener à bien le projet.  Aucune langue attendue Curiosité Esprit d'équipe Voir plus Algorithme Minimum 1 an d’expérience BigQuery Minimum 1 an d’expérience Voir plus Le Groupe SII est une société d'ingénierie et de conseils en technologies (ICT) et une entreprise de services numériques (ESN). Nous sommes au coeur de l'innovation au service de grands comptes dans des secteurs d'ingénierie variés.En 2023, pour la 6e année consécutive, SII France a obtenu le label Great Place To Work®. Nous avons été reconnus 3e entreprise de « + de 2500 salariés» où il fait bon vivre.Nous sommes très fiers d'obtenir cette reconnaissance de nos salariés !Ce succès est le reflet de notre culture basée sur notre volonté de proposer à tous nos salariés un cadre de travail épanouissant pour le développement de leurs compétences et carrières. En fonction de la mission, il est possible de réaliser jusqu à 50 % de télétravail grâce à notre accord dédié.Rejoignez le mouvement #fungenieur dans lequel la passion pour la technologie, la créativité, la proximité et l'esprit d'équipe sont mis à l'honneur.Le Groupe SII est une société handi-accueillante, signataire de la Charte de la diversité en entreprise.Alors si ces valeurs vous parlent, rejoignez-nous ! Le Groupe SII est une société d'ingénierie et de conseils en technologies (ICT) et une entreprise de services numériques (ESN). Nous sommes au coeur de l'innovation au service de grands comptes dans des secteurs d'ingénierie variés. En 2023, pour la 6e année consécutive, SII France a obtenu le label Great Place To Work®. Nous avons été reconnus 3e entreprise de « + de 2500 salariés» où il fait bon vivre.Nous sommes très fiers d'obtenir cette reconnaissance de nos salariés !Ce succès est le reflet de notre culture basée sur notre volonté de proposer à tous nos salariés un cadre de travail épanouissant pour le développement de leurs compétences et carrières. En fonction de la mission, il est possible de réaliser jusqu à 50 % de télétravail grâce à notre accord dédié. Rejoignez le mouvement #fungenieur dans lequel la passion pour la technologie, la créativité, la proximité et l'esprit d'équipe sont mis à l'honneur.Le Groupe SII est une société handi-accueillante, signataire de la Charte de la diversité en entreprise. Alors si ces valeurs vous parlent, rejoignez-nous ! Personne en charge du recrutement Léa BAUCHE - Chargée de Missions RH ",devenez prochain collaborateur nord tant data analyst intégrant équipe data client mission confiées aider conception modèles reporting aider calcul optimiser requêtes participer diver projets liés data développement algorithme croisement données etc devenez prochain collaborateur nord tant data analyst intégrant équipe data client mission confiées aider conception modèles reporting aider calcul optimiser requêtes participer diver projets liés data développement algorithme croisement données etc idéal oui uniquement idéal chez cherche cv collaboration durable issu formation supérieure bac justifiez expérience an min poste data analyst bigquery powerbi encore gcp plus secret compétences technique rigoureux chaque détail a importance curieux désireux connaître pourquoi comment organisé chaque journée commence to do sen service satisfaction client objectif premier qualités permettent mener bien projet idéal oui uniquement idéal chez cherche cv collaboration durable issu formation supérieure bac justifiez expérience an min poste data analyst bigquery powerbi encore gcp plus secret compétences technique rigoureux chaque détail a importance curieux désireux connaître pourquoi comment organisé chaque journée commence to do sen service satisfaction client objectif premier qualités permettent mener bien projet aucune langue attendue curiosité esprit voir plus algorithme minimum an expérience bigquery minimum an expérience voir plus groupe sii société conseils technology ict entreprise service numériques esn coeur service grand comptes secteurs année consécutive sii france a obtenu label great place to reconnus entreprise salariés où fait bon très fiers cette reconnaissance salariés succès reflet culture basée volonté proposer tous salariés cadre travail épanouissant développement leurs compétences carrières fonction mission possible réaliser jusqu télétravail grâce accord mouvement fungenieur lequel passion technologie créativité proximité mi groupe sii société signataire charte diversité si valeurs parlent groupe sii société conseils technology ict entreprise service numériques esn coeur service grand comptes secteurs variés année consécutive sii france a obtenu label great place to reconnus entreprise salariés où fait bon très fiers cette reconnaissance salariés succès reflet culture basée volonté proposer tous salariés cadre travail épanouissant développement leurs compétences carrières fonction mission possible réaliser jusqu télétravail grâce accord dédié rejoignez mouvement fungenieur lequel passion technologie créativité proximité mi groupe sii société signataire charte diversité entreprise alors si valeurs parlent personne charge recrutement léa bauche chargée mission rh,Apec
Data analyst,CDI  ,37500.0,Groupe Roullier,Dinard - 35,Bretagne,Ille-et-Vilaine,48.6320379,-2.0580178,Minimum 3 ans,skills,18/12/2023,"Intégré au sein de l'équipe BI & DATA de la DSI du Groupe ROULLIER, vous accompagnerez les métiers du Groupe dans la valorisation de leurs données. Vous prendrez en charge la gestion applicative et la mise en uvre de solutions Data & Business Intelligence.Vos missions sont les suivantes :1) Développer des solutions BI- Pilotage des projets BI/Reporting de bout en bout dans le respect des engagements (coûts / délais / qualité)- Recueil et analyse des besoins exprimés avec un rôle de conseil et d'accompagnateur auprès de nos métiers- Conception et réalisation (Transformation, modélisation et design de rapport)2) Maintenir et faire évoluer les outils existants :- Flux et modélisation de données- Maintien en condition opérationnelle du portefeuille d'applications- Suivi d'exploitation Assistance auprès de nos métiers sur les applications Data- Optimisation de rapport existant3) Contribuer à l'évolution de l'architecture Data & des pratiques BI- Création de nouveaux flux de données- Architecture du Data Warehouse- Veille sur les nouvelles tendances/méthodes- Accompagnement et formation des utilisateurs aux bonnes pratiques- Participer activement à la diffusion de la culture data Intégré au sein de l'équipe BI & DATA de la DSI du Groupe ROULLIER, vous accompagnerez les métiers du Groupe dans la valorisation de leurs données. Vous prendrez en charge la gestion applicative et la mise en uvre de solutions Data & Business Intelligence.Vos missions sont les suivantes :1) Développer des solutions BI- Pilotage des projets BI/Reporting de bout en bout dans le respect des engagements (coûts / délais / qualité)- Recueil et analyse des besoins exprimés avec un rôle de conseil et d'accompagnateur auprès de nos métiers- Conception et réalisation (Transformation, modélisation et design de rapport)2) Maintenir et faire évoluer les outils existants :- Flux et modélisation de données- Maintien en condition opérationnelle du portefeuille d'applications- Suivi d'exploitation Assistance auprès de nos métiers sur les applications Data- Optimisation de rapport existant3) Contribuer à l'évolution de l'architecture Data & des pratiques BI- Création de nouveaux flux de données- Architecture du Data Warehouse- Veille sur les nouvelles tendances/méthodes- Accompagnement et formation des utilisateurs aux bonnes pratiques- Participer activement à la diffusion de la culture data - Min 3 ans d'expériences- Vous maîtrisez l'anglais technique- Votre capacité d'adaptation, votre autonomie, votre sens du service ainsi que vos qualités relationnelles seront vos atouts pour réussir et évoluer au sein de la structure.Compétences :- Outils BI : Power BI, SSRS, Jedox, Cognos- Langage de prog. : SQL, Python- Intégration de données : SSIS, Talend- BDD : SQL Server, Oracle DWH- Environnement : Windows, LinuxQu'avons-nous à offrir- Jusqu'à 2 jours de télétravail par semaine- RTT- Une Prise en charge de l'abonnement transports en commun à hauteur de 75%- Un Comité interentreprise- Des accords de participation et d'intéressement- Une participation aux repasMais aussi- Un cadre de travail agréable situé à deux pas de la mer- Un bâtiment dédié aux activités sportives et culturelles- Une vie interne dynamique : Afterwork, teambuilding - Min 3 ans d'expériences- Vous maîtrisez l'anglais technique- Votre capacité d'adaptation, votre autonomie, votre sens du service ainsi que vos qualités relationnelles seront vos atouts pour réussir et évoluer au sein de la structure.Compétences :- Outils BI : Power BI, SSRS, Jedox, Cognos- Langage de prog. : SQL, Python- Intégration de données : SSIS, Talend- BDD : SQL Server, Oracle DWH- Environnement : Windows, LinuxQu'avons-nous à offrir- Jusqu'à 2 jours de télétravail par semaine- RTT- Une Prise en charge de l'abonnement transports en commun à hauteur de 75%- Un Comité interentreprise- Des accords de participation et d'intéressement- Une participation aux repasMais aussi- Un cadre de travail agréable situé à deux pas de la mer- Un bâtiment dédié aux activités sportives et culturelles- Une vie interne dynamique : Afterwork, teambuilding Anglais A1 Autonomie Capacité d'adaptation Voir plus Actions de formation Minimum 1 an d’expérience Analyse des besoins Minimum 1 an d’expérience Voir plus Groupe industriel, familial et indépendant, le Groupe Roullier réalise, grâce à ses 10 000 collaborateurs dont 70 % à l'international, 4,1 milliards d'euros de chiffre d'affaires consolidé. Ses activités diversifiées (nutrition des sols, des plantes, des animaux, agroalimentaire, énergies renouvelables), centrées sur les besoins humains, montrent l'ouverture d'esprit d'un Groupe connecté aux enjeux d'avenir.Avec 109 unités de production, partout dans le monde, c'est un Groupe, toujours en mouvement, qui fait de l'innovation et de l'amélioration continue un défi quotidien et qui donne à ses activités leaders (TIMAC AGRO, Phosphea, la Magnésie, l'Agroalimentaire), comme à son pôle de diversification (Algologie, Énergies renouvelables et Plasturgie), toute l'autonomie et la liberté de tester et d'avancer.Faire mieux, faire différemment, explorer les possibles, c'est la façon d'agir du Groupe Roullier. Groupe industriel, familial et indépendant, le Groupe Roullier réalise, grâce à ses 10 000 collaborateurs dont 70 % à l'international, 4,1 milliards d'euros de chiffre d'affaires consolidé. Ses activités diversifiées (nutrition des sols, des plantes, des animaux, agroalimentaire, énergies renouvelables), centrées sur les besoins humains, montrent l'ouverture d'esprit d'un Groupe connecté aux enjeux d'avenir.Avec 109 unités de production, partout dans le monde, c'est un Groupe, toujours en mouvement, qui fait de l'innovation et de l'amélioration continue un défi quotidien et qui donne à ses activités leaders (TIMAC AGRO, Phosphea, la Magnésie, l'Agroalimentaire), comme à son pôle de diversification (Algologie, Énergies renouvelables et Plasturgie), toute l'autonomie et la liberté de tester et d'avancer.Faire mieux, faire différemment, explorer les possibles, c'est la façon d'agir du Groupe Roullier. ",intégré sein bi data dsi groupe roullier accompagnerez métiers groupe valorisation leurs données prendrez charge gestion applicative mise uvre solution data business mission suivantes développer solution pilotage projets bout bout respect engagement coûts délais qualité recueil analyse besoins exprimés rôle conseil auprès conception réalisation transformation modélisation design rapport maintenir faire évoluer outils existants flux modélisation maintien condition opérationnelle portefeuille suivi assistance auprès métiers application optimisation rapport contribuer data pratiques création nouveaux flux architecture data veille nouvelles accompagnement formation utilisateurs bonnes participer activement diffusion culture data intégré sein bi data dsi groupe roullier accompagnerez métiers groupe valorisation leurs données prendrez charge gestion applicative mise uvre solution data business mission suivantes développer solution pilotage projets bout bout respect engagement coûts délais qualité recueil analyse besoins exprimés rôle conseil auprès conception réalisation transformation modélisation design rapport maintenir faire évoluer outils existants flux modélisation maintien condition opérationnelle portefeuille suivi assistance auprès métiers application optimisation rapport contribuer data pratiques création nouveaux flux architecture data veille nouvelles accompagnement formation utilisateurs bonnes participer activement diffusion culture data min an maîtrisez capacité autonomie sen service ainsi qualités relationnelles atouts réussir évoluer sein outils bi power bi ssrs jedox langage prog sql intégration données ssis bdd sql server oracle environnement window jusqu jours télétravail prise charge transport commun hauteur comité accord participation participation repasmais cadre travail agréable situé deux bâtiment dédié activités sportives vie interne dynamique afterwork teambuilding min an maîtrisez capacité autonomie sen service ainsi qualités relationnelles atouts réussir évoluer sein outils bi power bi ssrs jedox langage prog sql intégration données ssis bdd sql server oracle environnement window jusqu jours télétravail prise charge transport commun hauteur comité accord participation participation repasmais cadre travail agréable situé deux bâtiment dédié activités sportives vie interne dynamique afterwork teambuilding anglais autonomie capacité voir plus action formation minimum an expérience analyse besoins minimum an expérience voir plus groupe industriel familial indépendant groupe roullier réalise grâce collaborateurs dont milliard chiffre consolidé activités diversifiées nutrition sol plantes animaux agroalimentaire énergies renouvelables centrées besoins humains montrent groupe connecté enjeux unités production partout monde groupe toujours mouvement fait continue défi quotidien donne activités leader timac agro phosphea magnésie comme pôle diversification algologie énergies renouvelables plasturgie toute liberté tester mieux faire différemment explorer possible façon groupe roullier groupe industriel familial indépendant groupe roullier réalise grâce collaborateurs dont milliard chiffre consolidé activités diversifiées nutrition sol plantes animaux agroalimentaire énergies renouvelables centrées besoins humains montrent groupe connecté enjeux unités production partout monde groupe toujours mouvement fait continue défi quotidien donne activités leader timac agro phosphea magnésie comme pôle diversification algologie énergies renouvelables plasturgie toute liberté tester mieux faire différemment explorer possible façon groupe roullier,Apec
