title,type_job,salary,compagny,location,description,source
Rédacteur, 5  CDD  de 12 mois  à temps partiel (2/5) ,A partir de 19 k€ brut annuel,6MEDIAS - DIORANEWS,Paris 09 - 75,"·         Profil 1 : actu généraliste Journaliste confirmé(e), vous baignez dans l’actualité au quotidien. Politique, international, société, justice, fait divers, sport… Vous avez de l’intérêt pour tout ce qu’il se passe en France et dans le monde. Accro au web, vous aimez écrire sur tous les sujets. Vous avez une forte expérience dans une rédaction web.  ·         Profil 2 : économie/conso Journaliste aguerri(e), l’actualité économique vous captive. Sans être expert(e), vous disposez d’un regard avisé sur toutes les informations ayant attrait à la vie économique françaises, mais aussi sur les sujets conso assez concernants pour le grand public. Vous gardez un œil attentif sur le reste de l’actualité : vous vous tenez informé(e) quotidiennement de ce qu’il se passe en France et dans le monde. Vous aimez écrire sur tous les sujets. Vous avez une expérience dans une rédaction web. ·         Profil 3 : Télé/People/divertissement/SériesJournaliste passionné(e) par l’actualité people, le peopolitique, la télé, le cinéma ou encore les séries. De la famille royale britannique à Catherine Deneuve en passant par le dîner privé d‘Edouard Philippe avec Emmanuel Macron, vous êtes à l’aise avec une large palette de sujets. Vous avez une expérience confirmée dans une rédaction web. Les réseaux sociaux n’ont aucun secret pour vous.    ·         Profil 1 : actu généraliste  Journaliste confirmé(e), vous baignez dans l’actualité au quotidien. Politique, international, société, justice, fait divers, sport… Vous avez de l’intérêt pour tout ce qu’il se passe en France et dans le monde. Accro au web, vous aimez écrire sur tous les sujets. Vous avez une forte expérience dans une rédaction web.   ·         Profil 2 : économie/conso  Journaliste aguerri(e), l’actualité économique vous captive. Sans être expert(e), vous disposez d’un regard avisé sur toutes les informations ayant attrait à la vie économique françaises, mais aussi sur les sujets conso assez concernants pour le grand public. Vous gardez un œil attentif sur le reste de l’actualité : vous vous tenez informé(e) quotidiennement de ce qu’il se passe en France et dans le monde. Vous aimez écrire sur tous les sujets. Vous avez une expérience dans une rédaction web.  ·         Profil 3 : Télé/People/divertissement/Séries Journaliste passionné(e) par l’actualité people, le peopolitique, la télé, le cinéma ou encore les séries. De la famille royale britannique à Catherine Deneuve en passant par le dîner privé d‘Edouard Philippe avec Emmanuel Macron, vous êtes à l’aise avec une large palette de sujets. Vous avez une expérience confirmée dans une rédaction web. Les réseaux sociaux n’ont aucun secret pour vous.     Descriptif des postes (à pourvoir rapidement), 100% Télétravail possible :  Sous la responsabilité du directeur de l information et de ses adjoints, vous devrez alimenter et animer le site d actualités d un client de notre agence. Vos missions : ·       Assurer une veille complète de l actualité ·       Être force de propositions de sujets et d angles ·       Ecriture d articles web Vos atouts et compétences : ·       Vous maîtrisez les bases de l écriture journalistique web·       Vous maîtrisez les règles SEO ·       Vous savez déceler les sujets à fort potentiel d audience ·       Vous êtes organisé(e) et rigoureux(se)  ·       Travailler dans la rapidité et sous la pression de l actualité ne vous fait pas peur ·        Vous êtes disponible immédiatement, en horaires décalés, la semaine comme le week-end ·       Votre orthographe est irréprochable   Descriptif des postes (à pourvoir rapidement), 100% Télétravail possible :   Sous la responsabilité du directeur de l information et de ses adjoints, vous devrez alimenter et animer le site d actualités d un client de notre agence.  Vos missions :  ·       Assurer une veille complète de l actualité  ·       Être force de propositions de sujets et d angles  ·       Ecriture d articles web  Vos atouts et compétences :  ·       Vous maîtrisez les bases de l écriture journalistique web ·       Vous maîtrisez les règles SEO  ·       Vous savez déceler les sujets à fort potentiel d audience  ·       Vous êtes organisé(e) et rigoureux(se)   ·       Travailler dans la rapidité et sous la pression de l actualité ne vous fait pas peur  ·        Vous êtes disponible immédiatement, en horaires décalés, la semaine comme le week-end  ·       Votre orthographe est irréprochable    Aucune langue attendue Disponibilité Force de proposition Voir plus Rédaction web Minimum 5 ans d’expérience SEO Minimum 5 ans d’expérience Voir plus Créée en 1999, 6medias est une agence de presse digitale, qui fournit 24h sur 24 et 7 jours sur 7 un service éditorial complet et 360° à ses clients.Rejoignez notre équipe dynamique et soudée !6Medias est régulièrement à la recherche de nouveaux talents.  Créée en 1999, 6medias est une agence de presse digitale, qui fournit 24h sur 24 et 7 jours sur 7 un service éditorial complet et 360° à ses clients. Rejoignez notre équipe dynamique et soudée ! 6Medias est régulièrement à la recherche de nouveaux talents.    Autres offres de l'entreprise  Présélection par la RRH + Entretien téléphoniqueRendez-vous + test de rédaction à l'agenceIntégration Présélection par la RRH + Entretien téléphonique Rendez-vous + test de rédaction à l'agence Intégration Conseils Bonjour à tous,Il s'agit de postes de rédaction deskweb, en horaires décalés, travail les week-ends et jours fériés.La rémunération est à la pige : 101 brut / journée de vacation + TR + indemnité CP + fraction de 13ème moisIl ne m'est pas possible de l'indiquer directement dans l'agence.Nous recherchons des personnes aguerries à l'écriture web et au SEO.Cordialement,  Bonjour à tous, Il s'agit de postes de rédaction deskweb, en horaires décalés, travail les week-ends et jours fériés. La rémunération est à la pige : 101 brut / journée de vacation + TR + indemnité CP + fraction de 13ème mois Il ne m'est pas possible de l'indiquer directement dans l'agence. Nous recherchons des personnes aguerries à l'écriture web et au SEO. Cordialement,   Personne en charge du recrutement Sandra GREEN - Responsable Ressources Humaines ",apec
Développeur, 1  CDI  ,30 - 36 k€ brut annuel,AFPA,Lyon 01 - 69,"Formateur itinérant H/F, vous intervenez sur toute la France, selon les besoins des centres AFPA !Vos missions durent une semaine à quelques mois, ce qui implique des découchés. Qu'elle soit en début, milieu ou fin de parcours de formation, votre intervention (remplacement ou renfort) permet d'assurer la continuité pédagogique auprès des stagiaires.Vos missions consistent à :- Animer en autonomie des séances de formation,- Dérouler l'ensemble du programme défini par l'offre de services de l'Afpa,- Assurer le bon fonctionnement de votre plateau technique, ainsi que son approvisionnement logistique en exprimant vos besoins,- Dans le cadre de votre responsabilité social et pédagogique, suivre la progression des stagiaires,- Participer au collectif de travail du dispositif afin d'accompagner chaque stagiaire dans ses projets,- Promouvoir l'offre de services de l'Afpa auprès des entreprises avec lesquelles vous êtes en relation et concourir à la détection des besoins clients.Pour information, voici le titre sur lequel vous allez former : https://www.afpa.fr/formation-qualifiante/developpeur-web-et-web-mobileStatut cadre - 37H + RTT - Indemnités spécifiques aux itinérants (sujétion et temps de déplacement) : 390 €/mois - Congés supplémentaires - Prise en charge des frais professionnels conformément aux accords Afpa. Conditions d'exercice :Le formateur itinérant H/F exerce son métier, en fonction des besoins diversifiés de l'AFPA, sur son lieu de rattachement géographique, à l'extérieur de celui-ci, en entreprise et sur d'autres sites de formation. Expert dans domaine, il est également polyvalent sur les métiers connexes.Il travaille en face-à-face pédagogique, sur des plateaux techniques ; il utilise les outils digitaux.En plus de ses aptitudes relationnelles, il est à l'aise avec le numérique et les écrits professionnels.Vous savez ainsi :- Développer la partie front-end d'une application web ou web mobile en intégrant les recommandations de sécurité- Développer la partie back-end d'une application web ou web mobile en intégrant les recommandations de sécuritéPolyvalence souhaitée :- DevOpsConnaissances et savoir-faire techniques :- Animer des réunions de travail avec des développeurs ou des utilisateurs- Rédiger des comptes rendus de réunion- Elaborer les tests unitaires- Exploiter des diagrammes UML fournis pour modéliser une application (diagrammes : d'état, d'activité, de séquence, de classes)- Pratiquer un langage de programmation procédurale, événementielle et orientée objet- Pratiquer le langage SQL- Pratiquer les langages du développement web (balise HTML, feuille de style CSS et script client, JavaScript, Framework, script serveur (JSP, ASP.net ou PHP)- Concevoir une base de données (avec Merise ou UML)- Techniques de communication et de formation, en face à face et à distance- Culture générale des technologies de l'information et de la communication- Anglais technique lu, écrit et parléTitre(s) / diplôme(s) requis ou équivalence  :- Niveau 6 en informatique ou Niveau 5 en informatique et assimilation au niveau 6 par expérience professionnelleExpérience professionnelle exigée : 5 ans minimum d'expérience professionnelle dans le métier de développeur dont 2 ans au minimum dans des activités ayant permis de développer des applications informatiques de type web ou mobile.Avoir des compétences en formation et/ou une appétence pédagogique est un atout à votre candidature ; qu'elle soit vérifiée par l'expérience ou par les fonctions d'encadrement. Sans être obligatoire, un titre de ""Formateur Professionnel d'Adultes"" sera apprécié. Anglais A1 Autonomie Polyvalence Voir plus Application Web Minimum 1 an d’expérience Approvisionnement Minimum 1 an d’expérience Voir plus Vous rejoignez l'Afpa, premier organisme de formation des actifs en France. Vous intégrez un collectif de travail pour qui l'utilité sociale est une fierté, un moteur au quotidien pour accompagner les salariés et les publics les plus éloignés de l'emploi dans leur parcours de formation.Vous partagez les valeurs de l'Afpa : un attachement profond aux valeurs humaines, rejoignez-nous !Le Dispositif Itinérants recrute un Formateur ""Développeur Web et Web Mobile"" H/F dans la zone géographique privilégiée de l'Auvergne-Rhône-Alpes / Provence-Alpes-Côte d'Azur.Comme une agence intérimaire interne, le Dispositif itinérants met temporairement à disposition des formateurs professionnels au service des centres AFPA demandeurs. Avec le Dispositif itinérants, fini la routine !Vous partez à la rencontre de publics variés, de centres différents et de missions diverses sur des appels d'offres publics et privés ! Vous aimez le changement, intervenir pour des missions ponctuelles ; vous êtes réactif et agile, devenez formateur itinérant ! Vous rejoignez l'Afpa, premier organisme de formation des actifs en France. Vous intégrez un collectif de travail pour qui l'utilité sociale est une fierté, un moteur au quotidien pour accompagner les salariés et les publics les plus éloignés de l'emploi dans leur parcours de formation. Vous partagez les valeurs de l'Afpa : un attachement profond aux valeurs humaines, rejoignez-nous ! Le Dispositif Itinérants recrute un Formateur ""Développeur Web et Web Mobile"" H/F dans la zone géographique privilégiée de l'Auvergne-Rhône-Alpes / Provence-Alpes-Côte d'Azur. Comme une agence intérimaire interne, le Dispositif itinérants met temporairement à disposition des formateurs professionnels au service des centres AFPA demandeurs. Avec le Dispositif itinérants, fini la routine ! Vous partez à la rencontre de publics variés, de centres différents et de missions diverses sur des appels d'offres publics et privés ! Vous aimez le changement, intervenir pour des missions ponctuelles ; vous êtes réactif et agile, devenez formateur itinérant !  Autres offres de l'entreprise  ",apec
Développeur, 1  CDI  ,A négocier,1G LINK,Issy-les-Moulineaux - 92,"Le prestataire participera :  •  A l’évolution de la plateforme web (site web, site mobile, back Office et api) : ajout de fonctionnalités, développement, documentation  •  A l’ensemble des cérémoniaux agiles de l’équipe Le prestataire participera :  •  A l’évolution de la plateforme web (site web, site mobile, back Office et api) : ajout de fonctionnalités, développement, documentation  •  A l’ensemble des cérémoniaux agiles de l’équipe Expertises attendues- Javascript ES5 min., SASS, utilisation de PHP/twig- Webpack, Webpack encore, ES6 ou Typescript- Très bonnes compétences en web performance- Parfaite maitrise du HTML responsive- Bonne connaissance de l'utilisation de git- Une expérience PWA / Service Worker, des connaissances en SEO sont des plus très importants- Notions ou expérience en accessibilité- Expérience au sein d'un site à fort trafic- Expérience de travail en environnement agile Expertises attendues- Javascript ES5 min., SASS, utilisation de PHP/twig- Webpack, Webpack encore, ES6 ou Typescript- Très bonnes compétences en web performance- Parfaite maitrise du HTML responsive- Bonne connaissance de l'utilisation de git- Une expérience PWA / Service Worker, des connaissances en SEO sont des plus très importants- Notions ou expérience en accessibilité- Expérience au sein d'un site à fort trafic- Expérience de travail en environnement agile Aucune langue attendue Aucun savoir-être attendu HTML Minimum 10 ans d’expérience GIT Minimum 3 ans d’expérience Voir plus 1G-LINK accompagne aujourd'hui de grands comptes dans l'amélioration de l'expérience de ses clients et collaborateurs. Cela passe par la valeur intrinsèque de l'entreprise : la symétrie des attentions. L'intelligence collective et la passion de ses collaborateurs permet à 1G-LINK de proposer des solutions digitales disruptives et à forte valeur ajoutée en réponse aux besoins innovants de ses clients. Notre savoir-faire est le suivant :La passion de nos collaborateurs favorise leur épanouissement sur les projets à long terme ;La compréhension de l expérience des équipes métiers permet de s approprier l environnement client ;L expertise des collaborateurs 1G-Link permet d accompagner le client dans toutes les étapes de sa transformation ;C est par cette symétrie des attentions au quotidien que les consultants 1G-Link améliorent la chaîne de valeur client. 1G-LINK accompagne aujourd'hui de grands comptes dans l'amélioration de l'expérience de ses clients et collaborateurs. Cela passe par la valeur intrinsèque de l'entreprise : la symétrie des attentions.   L'intelligence collective et la passion de ses collaborateurs permet à 1G-LINK de proposer des solutions digitales disruptives et à forte valeur ajoutée en réponse aux besoins innovants de ses clients.   Notre savoir-faire est le suivant : La passion de nos collaborateurs favorise leur épanouissement sur les projets à long terme ; La compréhension de l expérience des équipes métiers permet de s approprier l environnement client ; L expertise des collaborateurs 1G-Link permet d accompagner le client dans toutes les étapes de sa transformation ; C est par cette symétrie des attentions au quotidien que les consultants 1G-Link améliorent la chaîne de valeur client.  Autres offres de l'entreprise  Personne en charge du recrutement MARIE PANIS - CHARGEE DE RECRUTEMENT ",apec
Ingénieur intégration progiciel, 1  CDD  de 12 mois  ,28 - 30 k€ brut annuel,Fed IT,Roncq - 59,"Vous êtes particulièrement sensible aux contextes internationaux et avez une bonne connexion avec le secteur du Marketing, E-commerce ? Vous aimez les environnements polyvalents et transversaux ? Alors j'ai peut-être LE POSTE qu'il vous faut… Je suis Laetitia Edeline, consultante en recrutement chez Fed IT Lille, et recherche un Intégrateur Web / Webmaster (F/H) pour mon client, filiale française d'un groupe international spécialisé dans la vente de produits de signalétique et de sécurité pour les professionnels.VOS ROLES ?Dans le cadre d'un remplacement, vous rejoignez l'équipe technique et êtes rattaché à la Manager E-commerce/ Website afin de contribuer à l'optimisation des sites web, en lien avec les objectifs de croissance. En tant qu'intégrateur web, vous assurez leur bon fonctionnement en assurant les tâches opérationnelles, notamment : la gestion des promotions, la création de contenu enrichi, la mise en place d'A/B tests, le recettage des fonctionnalités,… Vous travaillez avec les équipes e-Commerce et digitale en France, en Allemagne et au Royaume-Unis. Ainsi, pour ce poste, vous parlez anglais et français. Vous reprenez le code existant pour créer des pages web (HTML/CSS, basiques et complexes) et pouvez être amené à en créer un nouveau.Vous prenez notamment en charge les missions suivantes : * Intégration des outils promotionnels (bannières, widgets, landing pages, codes promotionnels …) en lien avec les équipes marketing et conformément au calendrier commercial multicanal prédéfini * Optimisation du moteur de recherche interne et des outils tiers * Amélioration de l'expérience client, notamment via la mise en place d'A/B tests * Optimisation des performances de navigation et de conversion via la mise en ligne de nouvelles fonctionnalités préalablement testées * Création de contenu enrichi VOTRE PROFIL ?Vous possédez une expérience de 2 ans minimum en intégration web et êtes à l'aise sur les langages HTML/CSS et Javascript. Idéalement, vous connaissez une plateforme de e-commerce (Magento), les outils d'A/B Testing et les environnements Agiles. Vous parlez un anglais technique.  Vous êtes reconnu comme une personne autonome, capacité de travailler en équipe, qui sait se montrer force de proposition. Vous comprenez les enjeux métier et êtes en capacité d'intervenir sur des projets spécifiques. Vous êtes doté d'un bon relationnel, d'une bonne communication générale et savez tenir un cahier des charges, respecter les délais imposés.  CE QUE NOUS VOUS PROPOSONS…- Un poste en CDD de 12 MOIS, Temp plein - Une rémunération de 30 K€ sur 12 mois - Des avantages : prime de participation aux bénéfices + tickets restaurants + avantages du CSE + Mutuelle & Prévoyance - Une entreprise renommée, à dimension internationale - Un contexte Agile - Une équipe dynamique et des échanges transverses riches  LE PROCESS DE RECRUTEMENT :Un premier entretien avec moi, si vous êtes pas déjà connu de Fed ! Ensuite, une voire deux étapes avec le client : - Un échange avec la RH - Une rencontre avec la Manager E-commerce Anglais A1 Français A1 Autonomie Capacité de communication Voir plus JavaScript Minimum 3 ans d’expérience A B Testing Minimum 1 an d’expérience Voir plus Je suis Laetitia Edeline, consultante en recrutement chez Fed IT Lille, et recherche un Intégrateur Web / Webmaster (F/H) pour mon client, filiale française d'un groupe international spécialisé dans la vente de produits de signalétique et de sécurité pour les professionnels.  Autres offres de l'entreprise  ",apec
Ingénieur intégration progiciel, 1  CDI  ,28 - 34 k€ brut annuel,Autobacs France,Pierrelaye - 95,"Autobacs France recrute, pour son siège social situé à Pierrelaye (95), un(e)  Intégrateur Web H/F sous contrat à durée indéterminée. Dans le cadre de son évolution engagée sur le digital, Autobacs France recherche un(e) intégrateur WEB afin d'assurer les mises à jour de son site internet sur l’offre produits et services. Au sein du service Informatique, vos missions consisteront notamment à : * Intégrer les référentiels : ajustement des visuels, création des produits & services ainsi que les argumentaires et les médias associés) pour les nouvelles offres * Optimiser l'existant * être le garant que l'offre web correspond aux besoins d'Autobacs France * Travailler en étroite collaboration avec les différents services interne dans l'obtention des données nécessaires Vous avez une réelle fibre commerciale afin de vous projeter dans vos créations afin qu’elles soient qualitatives, dans l’esprit de notre enseigne et attrayantes pour nos clients. Vous êtes autonome dans votre fonction afin de chercher et trouver les éléments nécessaires à votre travail. Vous êtes intéressé par le monde de l’automobile & des pièces techniques et avez idéalement une précédente expérience dans ce domaine d’activité.  Vous savez rédiger sans faute d’orthographe et de grammaire afin de pouvoir apporter du contenu de qualité. Autobacs France recrute, pour son siège social situé à Pierrelaye (95), un(e)  Intégrateur Web H/F sous contrat à durée indéterminée. Dans le cadre de son évolution engagée sur le digital, Autobacs France recherche un(e) intégrateur WEB afin d'assurer les mises à jour de son site internet sur l’offre produits et services. Au sein du service Informatique, vos missions consisteront notamment à : * Intégrer les référentiels : ajustement des visuels, création des produits & services ainsi que les argumentaires et les médias associés) pour les nouvelles offres * Optimiser l'existant * être le garant que l'offre web correspond aux besoins d'Autobacs France * Travailler en étroite collaboration avec les différents services interne dans l'obtention des données nécessaires Vous avez une réelle fibre commerciale afin de vous projeter dans vos créations afin qu’elles soient qualitatives, dans l’esprit de notre enseigne et attrayantes pour nos clients. Vous êtes autonome dans votre fonction afin de chercher et trouver les éléments nécessaires à votre travail. Vous êtes intéressé par le monde de l’automobile & des pièces techniques et avez idéalement une précédente expérience dans ce domaine d’activité.  Vous savez rédiger sans faute d’orthographe et de grammaire afin de pouvoir apporter du contenu de qualité. Profil * Formation Bac / Bac +2, * Vous avez déjà une expérience en tant qu’intégrateur Web * Vous maîtrisez les langages HTML / CSS (SASS) / BootStrap (4&5) / JavaScript, les outils de la suite Adobe Creative Cloud (Photoshop) et le Responsive Design n’a plus de secret pour vous. * La maîtrise de notre activité est essentielle pour se projeter dans ce que recherchent nos clients, une expérience sur un CMS E-Commerce serait un plus. Statut Cadre au forfait jour, salaire annuel selon profil et expérience, tickets restaurant, mutuelle, prévoyance et tarifs préférentiels sur l'ensemble de nos magasins, télétravail possible Ci-dessous des liens pour mieux nous connaître : Autobacs France (@autobacs_france) • Photos et vidéos Instagram Autobacs France - Accueil | Facebook AUTOBACS FRANCE |  Profil * Formation Bac / Bac +2, * Vous avez déjà une expérience en tant qu’intégrateur Web * Vous maîtrisez les langages HTML / CSS (SASS) / BootStrap (4&5) / JavaScript, les outils de la suite Adobe Creative Cloud (Photoshop) et le Responsive Design n’a plus de secret pour vous. * La maîtrise de notre activité est essentielle pour se projeter dans ce que recherchent nos clients, une expérience sur un CMS E-Commerce serait un plus. Statut Cadre au forfait jour, salaire annuel selon profil et expérience, tickets restaurant, mutuelle, prévoyance et tarifs préférentiels sur l'ensemble de nos magasins, télétravail possible Ci-dessous des liens pour mieux nous connaître : Autobacs France (@autobacs_france) • Photos et vidéos Instagram Autobacs France - Accueil | Facebook AUTOBACS FRANCE |  Aucune langue attendue Autonomie Bootstrap Protocol Minimum 5 ans d’expérience CSS Minimum 5 ans d’expérience Voir plus Rejoignez Autobacs France (10 magasins en Ile de France et Picardie), filiale du groupe Japonais Autobacs Seven leader du centre auto avec 650 magasins implantés dans 10 Pays. Le concept Autobacs : des magasins tout-en-un qui proposent la plus grande offre de produits et services d'entretie... Rejoignez Autobacs France (10 magasins en Ile de France et Picardie), filiale du groupe Japonais Autobacs Seven leader du centre auto avec 650 magasins implantés dans 10 Pays. Le concept Autobacs : des magasins tout-en-un qui proposent la plus grande offre de produits et services d'entretie...  Autres offres de l'entreprise  ",apec
