title,type_job,salary,compagny,location,description,source
Chef de projet informatique, 1  CDI  ,40 - 50 k€ brut annuel,Alten,Boulogne-Billancourt - 92,"Rattaché(e) à la direction technique d'Alten, vous intervenez auprès de clients Grands Comptes sur des problématiques de développement web, en mode projet ou tierce maintenance applicative. Vous participerez à la refonte et à l'amélioration de solutions en web 2.0Les compétences techniques requises :Solides compétences en JavaScriptExpérience significative sur la plateforme Node.JSConnaissances indispensables en Linux, MySQLUne bonne connaissance des problématiques de sécurité et de performances Rattaché(e) à la direction technique d'Alten, vous intervenez auprès de clients Grands Comptes sur des problématiques de développement web, en mode projet ou tierce maintenance applicative. Vous participerez à la refonte et à l'amélioration de solutions en web 2.0 Les compétences techniques requises : Diplômé(e) d'une école d'ingénieurs ou BAC+5 universitaire, vous bénéficiez d'une expérience dans ce domaine d'au moins 2 ans.Vous souhaitez rejoindre une équipe dynamique, n'attendez pas, postulez dès maintenant !Compétences attendues:Maitrîse de JavaScript, Node.JS, Linux, MySQL Ce poste est en CDI  Diplômé(e) d'une école d'ingénieurs ou BAC+5 universitaire, vous bénéficiez d'une expérience dans ce domaine d'au moins 2 ans. Vous souhaitez rejoindre une équipe dynamique, n'attendez pas, postulez dès maintenant ! Compétences attendues:   Ce poste est en CDI   Aucune langue attendue Aucun savoir-être attendu JavaScript Minimum 5 ans d’expérience Développement web Minimum 1 an d’expérience Voir plus Leader mondial en Ingénierie et IT Services, ALTEN accompagne en France et dans le monde entier la stratégie de développement de ses clients dans les domaines de l'innovation, de la R&D, des systèmes d'information et des réseaux.Labellisé en 2023 « Top employeur France » pour la 12ème année consécutive, le Groupe est un acteur majeur du recrutement d'ingénieurs en France et dans le monde. https://www.alten.fr/2023/02/07/alten-recoit-la-certification-top-employer-france-2023/Pourquoi nous rejoindre ?Des missions d'envergureUn management de proximitéUn accélérateur de carrière en France comme à l'InternationalUne cohésion d équipe Leader mondial en Ingénierie et IT Services, ALTEN accompagne en France et dans le monde entier la stratégie de développement de ses clients dans les domaines de l'innovation, de la R&D, des systèmes d'information et des réseaux. Labellisé en 2023 « Top employeur France » pour la 12ème année consécutive, le Groupe est un acteur majeur du recrutement d'ingénieurs en France et dans le monde. https://www.alten.fr/2023/02/07/alten-recoit-la-certification-top-employer-france-2023/ Pourquoi nous rejoindre ?  Autres offres de l'entreprise  Personne en charge du recrutement Arjun Dubaille - Chargé de recrutement ",apec
Développeur, 1  CDI  ,35 - 45 k€ brut annuel,UNICANCER,Le Kremlin-Bicêtre - 94,"FinalitésAssurer le développement, la mise en place, le suivi et l’exploitation d’applications webMaintenir les bases de données applicativesMaintenir les applications existantesAssurer le support aux utilisateursDéfinir et implanter des solutions techniques en programmant des lignes de code.Maîtriser les langages de programmation pour tenir une veille sur leur évolution.Assurer le développement technique d’une plate-forme adaptée aux besoins du client et leSuivi une fois celle-ci prête à l’emploiMissions :Respecter les instructions des cahiers des charges et des documentations fonctionnelles.Rédiger les documentations techniquesRéaliser des développements de nos outils web et logiciels (maquettage, spécification, conception, codage, tests).en respectant l’architecture technique définieModéliser et maintenir le modèle relationnel des bases de donnéesParticipation à la conception des outils et méthodes propres à l’environnement technique WebGestion de la maintenance du site web Finalités Missions : DUT, BUT, Licence pro informatiqueEcole d’ingénieurBac +2 à 5 développement informatique Langages de programmation (HTML5, CSS+, PHP, SQL, JavaScript, Nodejs…),Maîtrise d’outils nécessaires à la programmation : CMS (Content Management System), éditeurs de code…,Connaissances en architecture serveursConnaissance des bases de données relationnellesConnaissance des bonnes pratiques de gestion de projet de développementConnaissance de la gestion de projet AGILE Capacités relationnellesCapacité organisationnelles DUT, BUT, Licence pro informatique Ecole d’ingénieur Bac +2 à 5 développement informatique     Aucune langue attendue Sens de l'organisation Sens du relationnel Application Web Minimum 5 ans d’expérience Développement web Minimum 5 ans d’expérience Voir plus UNICANCER, acteur majeur de la cancérologie en France, regroupe la communauté des Centres de Lutte Contre le Cancer (CLCC), valorise leur modèle d'organisation en cancérologie et mutualise leurs ressources et leurs compétences afin de donner une dynamique nouvelle à la prise en charge des patients.La direction des Datas d’Unicancer, a lancé en 2014 le programme ESMÉ (« Épidémio-Stratégie Médico-Economique »), initiative académique indépendante et unique ayant permis de centraliser les données de vie réelle de plus de 75 000 patients traités pour un cancer du sein, de l’ovaire et du poumon. Cette initiative a d’ores et déjà apporté à la communauté médicale et scientifique des éclairages majeurs sur les caractéristiques de ces maladies ainsi que sur l’efficacité des stratégies thérapeutiques employées. Fort de ses savoir-faire, du soutien et de la reconnaissance de ses partenaires publics et privés, Unicancer a lancé en 2021 deux nouvelles plateformes nationales ambitieuses, l’entrepôt OncoDataHub (ODH) à visée d’observatoire du médicament en oncologie, et l’infrastructure WeShare, infrastructure dédiée à la recherche en sciences humaines et sociales, qui permettront de faire avancer les connaissances, d’apporter des éclairages nouveaux aux autorités de santé et de faire des patients des acteurs clés dans l’évaluation des stratégies thérapeutiques et dans la gestion de l’après-cancer. UNICANCER, acteur majeur de la cancérologie en France, regroupe la communauté des Centres de Lutte Contre le Cancer (CLCC), valorise leur modèle d'organisation en cancérologie et mutualise leurs ressources et leurs compétences afin de donner une dynamique nouvelle à la prise en charge des patients. La direction des Datas d’Unicancer, a lancé en 2014 le programme ESMÉ (« Épidémio-Stratégie Médico-Economique »), initiative académique indépendante et unique ayant permis de centraliser les données de vie réelle de plus de 75 000 patients traités pour un cancer du sein, de l’ovaire et du poumon. Cette initiative a d’ores et déjà apporté à la communauté médicale et scientifique des éclairages majeurs sur les caractéristiques de ces maladies ainsi que sur l’efficacité des stratégies thérapeutiques employées. Fort de ses savoir-faire, du soutien et de la reconnaissance de ses partenaires publics et privés, Unicancer a lancé en 2021 deux nouvelles plateformes nationales ambitieuses, l’entrepôt OncoDataHub (ODH) à visée d’observatoire du médicament en oncologie, et l’infrastructure WeShare, infrastructure dédiée à la recherche en sciences humaines et sociales, qui permettront de faire avancer les connaissances, d’apporter des éclairages nouveaux aux autorités de santé et de faire des patients des acteurs clés dans l’évaluation des stratégies thérapeutiques et dans la gestion de l’après-cancer.  Autres offres de l'entreprise  Personne en charge du recrutement Sophie CRAVE - RRH ",apec
Ingénieur d'affaires en informatique, 1  CDI  ,28 - 55 k€ brut annuel,SASU SUD CONSEILS ET RECRUTEMENTS,Montpellier - 34,"Vous souhaitez vous surpasser et développer vos compétences sur un poste de Conseiller commercial  digitalH/F, dans une entreprise, avec une équipe soudée ? Nous avons le poste qu'il vous faut : Nous recherchons pour notre client un commercial, des Commerciaux H/F pour un poste en CDI situé à Montpellier (Millénaire). Vous connaissez le secteur des sites vitrines / sites webs ? Vous êtes un commercial prêt à vous dépasser ? Vous êtes un chasseur dans l'âme ? Ce poste est fait pour vous ! Je recrute un cadre commercial pour le N°1 français du marketing digital et de la communication web. En occupant ce poste, vous serez en relation avec les clients et serez leur interlocuteur privilégié. Notre client vous offre de nombreux avantages. Au sein des équipes dédiées de chasse, votre mission sera de développer les ventes digitales sur le périmètre qui vous sera confié en assurant la prise de RDV auprès de nos prospects, et la conquête de nouveaux clients grâce à une large gamme de solutions de communication adaptées (Google Ads, Facebook Ads, Instagram Ads, Site Internet...). Ces outils seront vos armes pour séduire vos prospects au travers d une véritable web stratégie, comme un véritable coach digital au service de leurs enjeux.Salaire fixe 28k brut annuel + primes sur objectifs (non plafonnées) possibilité d'atteindre 50 à 90K de variable.Statut CADRE au forfait Télétravail possible Avantages : Voiture de fonction Carte essenceTickets restaurants MutuelleCE 5 semaines de congé + 11 RTT Vous souhaitez vous surpasser et développer vos compétences sur un poste de Conseiller commercial  digitalH/F, dans une entreprise, avec une équipe soudée ?  Nous avons le poste qu'il vous faut : Nous recherchons pour notre client un commercial, des Commerciaux H/F pour un poste en CDI situé à Montpellier (Millénaire). Vous connaissez le secteur des sites vitrines / sites webs ? Vous êtes un commercial prêt à vous dépasser ? Vous êtes un chasseur dans l'âme ? Ce poste est fait pour vous ! Je recrute un cadre commercial pour le N°1 français du marketing digital et de la communication web. En occupant ce poste, vous serez en relation avec les clients et serez leur interlocuteur privilégié. Notre client vous offre de nombreux avantages. Au sein des équipes dédiées de chasse, votre mission sera de développer les ventes digitales sur le périmètre qui vous sera confié en assurant la prise de RDV auprès de nos prospects, et la conquête de nouveaux clients grâce à une large gamme de solutions de communication adaptées (Google Ads, Facebook Ads, Instagram Ads, Site Internet...). Ces outils seront vos armes pour séduire vos prospects au travers d une véritable web stratégie, comme un véritable coach digital au service de leurs enjeux.Salaire fixe 28k brut annuel + primes sur objectifs (non plafonnées) possibilité d'atteindre 50 à 90K de variable.Statut CADRE au forfait Télétravail possible  Avantages :  Voiture de fonction  Carte essence Tickets restaurants  Mutuelle CE  5 semaines de congé + 11 RTT Pas de diplôme requis, votre MOTIVATION fera toute la différence. Cependant, une première expérience en commerce terrain est requise, de la vente en One shot est un plus. Vos autres qualités : Dynamique Organisé(e)Résistant(e)Créatif(ve)Appétence pour le chiffre Autonomie Pas de diplôme requis, votre MOTIVATION fera toute la différence. Cependant, une première expérience en commerce terrain est requise, de la vente en One shot est un plus. Vos autres qualités :  Dynamique  Organisé(e) Résistant(e) Créatif(ve) Appétence pour le chiffre  Autonomie Aucune langue attendue Autonomie Créativité Voir plus Commerce Minimum 1 an d’expérience Communication Minimum 1 an d’expérience Voir plus Alphéa Conseil, ce sont 15 années d'existence, 21 agences, plus de 700 recrutements par an, 85% de satisfaction clients, et 90% de satisfaction candidats.Notre cabinet de conseil en recrutement et stratégie intervient dans plusieurs secteurs d'activité dont certains avec une expertise reconnue comme la distribution, le retail, l'industrie ou l'agroalimentaire.Alphéa Conseil est le spécialiste du recrutement des cadres dirigeants et du middle management. Notre expertise, notre proximité et notre exigence font de nous un acteur incontournable de votre recrutement en France et à l'international.  Chacun de nos dirigeants à plus de 15 ans d'expertise de votre domaine. Alphéa Conseil, ce sont 15 années d'existence, 21 agences, plus de 700 recrutements par an, 85% de satisfaction clients, et 90% de satisfaction candidats.Notre cabinet de conseil en recrutement et stratégie intervient dans plusieurs secteurs d'activité dont certains avec une expertise reconnue comme la distribution, le retail, l'industrie ou l'agroalimentaire.Alphéa Conseil est le spécialiste du recrutement des cadres dirigeants et du middle management. Notre expertise, notre proximité et notre exigence font de nous un acteur incontournable de votre recrutement en France et à l'international.  Chacun de nos dirigeants à plus de 15 ans d'expertise de votre domaine.  Autres offres de l'entreprise  Personne en charge du recrutement Léa Fontugne - Chargée de recrutement ",apec
Développeur, 1  CDI  ,35 - 40 k€ brut annuel,Seyos,La Gaubretière - 85,"Notre client est une société vendéenne spécialisée dans la fabrication et la distribution de chaussures haut de gamme.Grâce à un savoir-faire unique, la société réalise aujourd'hui un chiffre d'affaires de 40 Millions d'Euros dont 20% à l'export.Afin de poursuivre son développement et pour renforcer son équipe en charge des sites marchands et des marketplaces, notre client recrute un Développeur Web, dont les missions principales consistent à :- Prendre en charge les développements Internet qui vous seront confiés à partir des expressions de besoins formulées par les services utilisateurs.- Rédiger les documentations techniques (cahier des charges, suivi de développement et procédure de maintenance).- Participer à la mise en place des échanges via API entre les sites web et l'ERP Business Central.Rémunération : selon profil + prime conventionnelle + participationLocalisation : La GaubretièreTélétravail : possibilité d'1 jour / semaineEnvironnement technique : PHP 7, Symfony 6, Prestashop 1.7, Javascript, MySQL, Linux, POO, WebServices REST, API Vous disposez d'une expérience professionnelle de minimum 2 ans sur des projets e-commerce, et êtes à l'aise sur l'environnement technique demandé.Vous êtes autonome dans la réalisation et dans la livraison à date d'un développement de bonne qualité, documenté et testé.Vous aimez le travail en équipe et savez communiquer, tant en expression orale qu'écrite.Au-delà de vos compétences techniques, vous souhaitez vous investir sur du long terme au sein de la société. Aucune langue attendue Autonomie Capacité de communication Voir plus Cahier des charges Minimum 1 an d’expérience Documentation Minimum 1 an d’expérience Voir plus Seyos est un cabinet de recrutement spécialisé dans les métiers de l'IT. Nous intervenons au niveau national et proposons aux candidats des opportunités professionnelles au sein d'éditeurs de logiciels, DSI d'entreprises (clients finaux), startups, acteurs E-commerce. En 9 années d'existence, plus de 1 300 professionnels de l'IT et du Digital ont déjà été recrutés par l'intermédiaire de Seyos au sein de 400 entreprises.  Autres offres de l'entreprise  ",apec
Chef de projet digital, 1  CDI  ,A négocier,Kosmos,Nantes - 44,"Vous rejoignez l’équipe des Chefs de Projets pour l’activité KOSMOS Solutioning, une équipe soudée où la bonne ambiance et l’esprit d’entraide font partie du quotidien. Vous contribuez à la réalisation d’applications web aux enjeux fonctionnels, techniques et ergonomiques orientés « grand public », répondant à des besoins utilisateurs variés et participant à l'accompagnement de l'éducation des générations présentes et futures.Vous pilotez des projets répondant aux besoins spécifiques de nos clients : universités, grandes écoles et autres acteurs de l’éducation et de la formation. Vous avez la responsabilité de la gestion de vos projets de A à Z et maitrisez l’intégralité du périmètre, en travaillant en étroite collaboration avec l’équipe de développement dédiée à cette activité :Vous intervenez dès l’avant-vente et la réponse aux appels d’offreVous réalisez le cadrage, l’analyse et le chiffrage des besoinsVous maitrisez le calendrier et le budget des projetsEn véritable Chef.fe d’orchestre, vous animez et coordonnez le travail de l’ensemble des intervenants, vous suivez l’avancement, planifiez les livraisons, organisez et supervisez les recettesVous êtes l’interlocuteur.trice privilégié.e de vos clients, auprès desquels vous développez une relation de qualité : suivre le contrat et les engagements, réaliser le reporting, animer les comités de pilotage, etc.Vous montrez en compétences sur nos solutions grâce à l'accompagnement de nos équipes.Vous n’avez pas le temps de vous ennuyer, vous appréciez la variété des missions et ne connaissez pas la routine ! Vous rejoignez l’équipe des Chefs de Projets pour l’activité KOSMOS Solutioning, une équipe soudée où la bonne ambiance et l’esprit d’entraide font partie du quotidien.   Vous contribuez à la réalisation d’applications web aux enjeux fonctionnels, techniques et ergonomiques orientés « grand public », répondant à des besoins utilisateurs variés et participant à l'accompagnement de l'éducation des générations présentes et futures. Vous pilotez des projets répondant aux besoins spécifiques de nos clients : universités, grandes écoles et autres acteurs de l’éducation et de la formation.   Vous avez la responsabilité de la gestion de vos projets de A à Z et maitrisez l’intégralité du périmètre, en travaillant en étroite collaboration avec l’équipe de développement dédiée à cette activité : Vous montrez en compétences sur nos solutions grâce à l'accompagnement de nos équipes. Vous n’avez pas le temps de vous ennuyer, vous appréciez la variété des missions et ne connaissez pas la routine ! Issu.e d’une formation Bac+5 (école d’ingénieur ou université), vous bénéficiez d'une expérience confirmée d'au moins cinq ans sur une fonction similaire notamment en pilotage de projets applicatifs et/ou webEn particulier, vous maitrisez le pilotage de projets en mode forfait et le respect des engagements associésVotre capacité à comprendre les enjeux et besoins utilisateurs vous permet de mettre en œuvre une démarche de conseil vis-à-vis des clients qui apprécieront par ailleurs votre écoute, votre sens du service et du résultatUn bon degré d’autonomie, un relationnel de qualité et de la rigueur sont des atouts majeurs pour réussir sur ce poste. Aucune langue attendue Autonomie Capacité d’écoute Voir plus Analyse des besoins Minimum 1 an d’expérience Application Web Minimum 1 an d’expérience Voir plus Kosmos est le spécialiste de la transformation digitale du monde de l’éducation depuis plus de 20 ans, comptant 5 millions d'utilisateurs au quotidien dans plus de 70 pays.Leader dans son secteur d’activité et acteur incontournable de la EdTech.Kosmos travaille à développer des solutions innovantes adaptées à une école de plus en plus connectée, personnalisée et adaptative.Votre métier exercé chez Kosmos a du sens : vous œuvrez pour améliorer et faire évoluer le monde de l'enseignement. Kosmos est le spécialiste de la transformation digitale du monde de l’éducation depuis plus de 20 ans, comptant 5 millions d'utilisateurs au quotidien dans plus de 70 pays. Leader dans son secteur d’activité et acteur incontournable de la EdTech. Kosmos travaille à développer des solutions innovantes adaptées à une école de plus en plus connectée, personnalisée et adaptative. Votre métier exercé chez Kosmos a du sens : vous œuvrez pour améliorer et faire évoluer le monde de l'enseignement.  Autres offres de l'entreprise  ",apec
Développeur, 1  CDI  ,A négocier,LINKT,Mont-Saint-Aignan - 76,"Rattaché au service SI, ta mission sera de concevoir, estimer et mettre en place toutes les briques techniques de notre SI.L'équipe dont tu feras partie à l'autonomie de conception et de choix technologiques pour améliorer version après version notre SI.A ce titre tu as la charge de :Analyser les besoins utilisateurs des clients internes et externes ;Développer les applications métier en environnement Web et/ou applicatif (CRM, ERP, Extranet, ...) ;Mise en oeuvre d'API (REST/SOAP) et de webservices ;Concevoir de nouvelles solutions et optimiser les fonctionnalités existantes ;Etre force de proposition sur la conception des solutions (outils, technologies, ...) ;Assurer le support auprès des utilisateurs ;Qualifier nos solutions : tests unitaires, d'intégration (automatiques et/ou manuels) ;Participer aux recettes avec les utilisateurs ;Maintenir les solutions existantes (NodeJS, Laravel, ReactJS, ?) et développer les solutions de demain sur les technologies adéquates ;Compétences en Docker, GitLab, système de versioning Git, base de données MariaDB/SQL server ;Assurer une veille technologique (mise en place de POCs, « starter kits », ?).Ce poste est basé à Mont-Saint-Aignan. Ta rémunération sera en fonction de ton niveau de diplôme et ton expérience. Rattaché au service SI, ta mission sera de concevoir, estimer et mettre en place toutes les briques techniques de notre SI. L'équipe dont tu feras partie à l'autonomie de conception et de choix technologiques pour améliorer version après version notre SI. A ce titre tu as la charge de : Analyser les besoins utilisateurs des clients internes et externes ; Développer les applications métier en environnement Web et/ou applicatif (CRM, ERP, Extranet, ...) ; Mise en oeuvre d'API (REST/SOAP) et de webservices ; Concevoir de nouvelles solutions et optimiser les fonctionnalités existantes ; Etre force de proposition sur la conception des solutions (outils, technologies, ...) ; Assurer le support auprès des utilisateurs ; Qualifier nos solutions : tests unitaires, d'intégration (automatiques et/ou manuels) ; Participer aux recettes avec les utilisateurs ; Maintenir les solutions existantes (NodeJS, Laravel, ReactJS, ?) et développer les solutions de demain sur les technologies adéquates ; Compétences en Docker, GitLab, système de versioning Git, base de données MariaDB/SQL server ; Assurer une veille technologique (mise en place de POCs, « starter kits », ?). Ce poste est basé à Mont-Saint-Aignan. Ta rémunération sera en fonction de ton niveau de diplôme et ton expérience. Tu es titulaire d'un diplôme de type Bac+4/5 en informatique ;Tu disposes d'une expérience significante sur un poste similaire ;Tu possèdes des qualités d'organisation et de rigueur ;Tu apprécies le travail en équipe ;Tu es dynamique et doté d'une excellente capacité relationnelle et d'écoute. Tu es titulaire d'un diplôme de type Bac+4/5 en informatique ; Tu disposes d'une expérience significante sur un poste similaire ; Tu possèdes des qualités d'organisation et de rigueur ; Tu apprécies le travail en équipe ; Tu es dynamique et doté d'une excellente capacité relationnelle et d'écoute. Aucune langue attendue Capacité d’écoute Dynamisme Voir plus Analyse des besoins clientèle Minimum 1 an d’expérience Base de données Minimum 1 an d’expérience Voir plus Linkt est l'expert des télécoms B to B du groupe Altitude dédié aux ETI, Grands comptes et collectivités locales.Linkt en quelques chiffres : 400 collaborateurs, 20 implantations et plus de 4 000 clients.Véritable accélérateur de business pour ses clients, Linkt propose une offre  360 :  de la connectivité très haut débit aux communications unifiées en passant par des services de haute valeur ajouté.Linkt est l'opérateur n°1 du VPN. Notre ambition, devenir le 3ème opérateur B to B en France.Que diriez-vous de participer à cette aventure avec nous ?Dans ce cadre, nous recrutons un Développeur Web Sénior H/F en CDI. Linkt est l'expert des télécoms B to B du groupe Altitude dédié aux ETI, Grands comptes et collectivités locales. Linkt en quelques chiffres : 400 collaborateurs, 20 implantations et plus de 4 000 clients. Véritable accélérateur de business pour ses clients, Linkt propose une offre  360 :  de la connectivité très haut débit aux communications unifiées en passant par des services de haute valeur ajouté. Linkt est l'opérateur n°1 du VPN. Notre ambition, devenir le 3ème opérateur B to B en France. Que diriez-vous de participer à cette aventure avec nous ? Dans ce cadre, nous recrutons un Développeur Web Sénior H/F en CDI.  Autres offres de l'entreprise  ",apec
