title,type_job,salary,compagny,location,description,source
Développeur, 1  CDD  de 36 mois  ,A partir de 31 k€ brut annuel,COMMUNAUTE D'AGGLOMERATION LA ROCHELLE,La Rochelle - 17,"Au sein de la Direction Systèmes d Information, sous l'autorité du responsable de l'unité Web et Data, vous êtes chargé de la mise en œuvre de solutions et de développements relatifs aux technologies web, répondant aux besoins fonctionnels et conformes à l'architecture logicielle et technique. Vous réalisez les solutions retenues et participez à leur intégration. Vous assurez l'étude, le pilotage et la gestion des projets web (sites internet, intranet, applications mobiles ), leur maintien en conditions opérationnelles (support de 2ème et 3ème niveau) et leur adéquation avec les exigences et standards de qualité web. Réaliser/développer des interfaces et modules webRéaliser la conception fonctionnelle et technique des solutions web.Développer les interfaces et modules web (écriture de code-source)Le cas échéant, participer à la procédure d achat de modules externes, analyser les offres et proposer un choix en s assurant de la cohérence technique des solutions retenuesEn phase d intégration, garantir la cohérence et la compatibilité des projets/données avec l environnement SI (paramétrage, optimisation, standards de qualité web, )Etudier et analyser en amont les opportunités de développementsRéaliser des études d opportunité et de faisabilité de composants et solutions web.Recueillir et analyser les besoins fonctionnels des utilisateurs.Concevoir et décrire les solutions en cohérence avec les architectures existantes et la stratégie d'évolution.Assurer l adéquation des solutions proposées aux exigences et standards de qualité web.Assurer le pilotage et la mise en œuvre des projets de développementsAnimer la collaboration entre les acteurs du projet (partage d information et de méthodes).Organiser le projet et évaluer les risques (techniques, financiers, ).Elaborer le cahier des charges et le calendrier de réalisation.Accompagner les utilisateurs et les autres acteurs selon leurs besoins (formations, transferts de compétences, ).Rapporter les évènements, évolutions, phases et étapes du projet.Elaborer et suivre l exécution du budget du projet.Maintenir en conditions opérationnelles les solutions web réaliséesRédiger les documentations techniques des solutions mises en œuvre.Assurer l assistance de niveau 2 et 3 (problèmes complexes), identifier et corriger les dysfonctionnements.Coordonner le suivi de la maintenance corrective/évolutive en collaboration avec les référents fonctionnels.Gérer les éventuelles relations contractuelles avec les éditeurs.Participer aux projets métiers dans leurs dimensions webParticiper à la rédaction des études et pièces techniques des projets métiers dans leurs dimensions webCoordonner l intégration technique des solutions métiers.Adapter les solutions dans leur composantes techniques.Vérifier l adéquation des portails métiers aux exigences et standards de qualité web.Activités secondairesVeille sur les solutions applicatives et les évolutions technologiques et fonctionnelles.  Au sein de la Direction Systèmes d Information, sous l'autorité du responsable de l'unité Web et Data, vous êtes chargé de la mise en œuvre de solutions et de développements relatifs aux technologies web, répondant aux besoins fonctionnels et conformes à l'architecture logicielle et technique. Vous réalisez les solutions retenues et participez à leur intégration. Vous assurez l'étude, le pilotage et la gestion des projets web (sites internet, intranet, applications mobiles ), leur maintien en conditions opérationnelles (support de 2ème et 3ème niveau) et leur adéquation avec les exigences et standards de qualité web.   Réaliser/développer des interfaces et modules web Etudier et analyser en amont les opportunités de développements Assurer le pilotage et la mise en œuvre des projets de développements Maintenir en conditions opérationnelles les solutions web réalisées Participer aux projets métiers dans leurs dimensions web Activités secondairesVeille sur les solutions applicatives et les évolutions technologiques et fonctionnelles.   Compétences techniques:Maîtriser les langages et les standards du Web : HTML5, CSS3, Javascript,Maîtriser les frameworks de développement front-end : VueJS,Maîtriser l articulation entre les composants back-end et front-end : manipulation d API, inter-opérabilité,Maîtriser les concepts liés à la pratique du Web et à l'assurance-qualité web : ergonomie, responsive web design, accessibilité, expérience utilisateur (UX), éco-conception, respect des données personnelles,Maîtriser les outils et environnements de type portail d'entreprise et CMS (Liferay, WordPress, ) et le langage de templating (Freemarker, )Maîtriser l'ingénierie de projets (classique et agile)Connaitre les technologies mobiles : applications natives, progressive web apps (PWA)Connaitre les langages de développement back-end : PHP, Java,Connaitre les solutions techniques informatiques (N tiers, architectures web, mobiles )Connaitre les outils d'automatisation de processus Web : industrialisation, intégration continue, supervision,Connaitre la réglementation juridique du web (RGPD, RGAA, dématérialisation, )Connaitre les métiers, les outils SI et le fonctionnement des collectivitésConnaitre le budget et la gestion de l'achat publicSavoir-faireDévelopper et maintenir des interfaces et modules web.Analyser des problèmes (techniques, organisationnels, liés au changement, ) et élaborer des stratégies de résolution.Contrôler des travaux d exploitation ou de projet.Accompagner les utilisateurs (préparation au changement, formation )Recueillir, analyser et restituer la demande et le besoin.Identifier, analyser et rapporter les risques et opportunités du projet.Hiérarchiser et établir des priorités d'actions selon les enjeux.Fédérer et animer la collaboration entre les acteurs du projet.Organiser et coordonner l ensemble des activités et travaux liés au projet.Synthétiser et rapporter les informations clés du projet.Exposer efficacement par écrit et oralement.Préparer les pièces techniques des procédures de marchés publics et élaborer les critères de choix.Savoir vérifier l adéquation de la solution mise en œuvre avec les engagements pris (données, fonctionnalités et processus de travail d une part, livraison et délais d autre part)Rédiger des procédures d intégration et d utilisation.Respecter les délais.Savoir-êtreAvoir le sens de l écouteÊtre force de propositionÊtre disponible et réactifÊtre autonomeÊtre curieux et faire preuve de sens critique Compétences techniques: Savoir-faire Savoir-être Aucune langue attendue Autonomie Capacité à fédérer Voir plus Analyse des offres Minimum 5 ans d’expérience CSS Minimum 5 ans d’expérience Voir plus Cité millénaire résolument tournée vers l'avenir, La Rochelle est une ville belle et généreuse qui conjugue la préservation d un patrimoine naturel et architectural exceptionnel et un développement innovant, raisonné et harmonieux de son territoire. Nichée au coeur de la façade atlantique, elle a su faire de son ancrage maritime un formidable atout de développement économique, touristique et culturel. Capitale de la Charente-Maritime, elle compte parmi les villes les plus attractives et les plus dynamiques de France. Cité millénaire résolument tournée vers l'avenir, La Rochelle est une ville belle et généreuse qui conjugue la préservation d un patrimoine naturel et architectural exceptionnel et un développement innovant, raisonné et harmonieux de son territoire. Nichée au coeur de la façade atlantique, elle a su faire de son ancrage maritime un formidable atout de développement économique, touristique et culturel. Capitale de la Charente-Maritime, elle compte parmi les villes les plus attractives et les plus dynamiques de France.  Autres offres de l'entreprise  Les candidatures seront transmises au service pour étude dès la clôture de la diffusion le 29/12.  Les candidatures seront transmises au service pour étude dès la clôture de la diffusion le 29/12.  Conseils Déplacements sur les sites de la collectivité et dans les communes de l agglomérationTemps de travail: 38h3517 jours RTTTélétravail possiblePour tout renseignement complémentaire, vous pouvez contacterMonsieur RENARD Jérémy ,Responsable de l unité web et data,tél : 05 46 30 37 18 Déplacements sur les sites de la collectivité et dans les communes de l agglomérationTemps de travail: 38h3517 jours RTTTélétravail possible Pour tout renseignement complémentaire, vous pouvez contacterMonsieur RENARD Jérémy ,Responsable de l unité web et data,tél : 05 46 30 37 18 Personne en charge du recrutement Pauline FRAPPIER - Chargée de recrutement ",apec
Développeur, 1  CDI  ,40 - 45 k€ brut annuel,Seyos,Nantes - 44,"Notre client, agence tech et digitale, accompagne les entreprises dans leur transformation numérique en créant à leurs côtés des solutions numériques performantes.Leurs clients sont principalement des PME et ETI, soucieuses de pérenniser leurs activités en intégrant le numérique dans leurs offres et leurs processus internes.Engagé dans une démarche d'amélioration continue et détenteur du Label Numérique Responsable, notre client recherche un Développeur Web.Intégré·e au sein de l'équipe technique composée de développeur·se·s web et mobiles, vous prendrez en charge les missions suivantes :- Analyse et chiffrage de projets en phase d'avant-vente- Conception, développement et mise en production d'applications web frontend et/ou backend- Suivi et maintenance des applications en production- Co-construction des webservices consommés par les applications web et mobileSi vous souhaitez intégrer une équipe de passionnés, ce poste est fait pour vous !!! Notre client, agence tech et digitale, accompagne les entreprises dans leur transformation numérique en créant à leurs côtés des solutions numériques performantes.Leurs clients sont principalement des PME et ETI, soucieuses de pérenniser leurs activités en intégrant le numérique dans leurs offres et leurs processus internes.Engagé dans une démarche d'amélioration continue et détenteur du Label Numérique Responsable, notre client recherche un Développeur Web.Intégré·e au sein de l'équipe technique composée de développeur·se·s web et mobiles, vous prendrez en charge les missions suivantes :- Analyse et chiffrage de projets en phase d'avant-vente- Conception, développement et mise en production d'applications web frontend et/ou backend- Suivi et maintenance des applications en production- Co-construction des webservices consommés par les applications web et mobileSi vous souhaitez intégrer une équipe de passionnés, ce poste est fait pour vous !!! De formation supérieure en informatique ou d'une reconversion professionnelle, vous possédez une bonne culture du web frontend et backend.Côté technique, vous êtes à l'aise avec PHP 8, Symfony 6 et avez des notions de NodeJS.Autonomie, ouverture d'esprit et sens du collectif sont des qualités indispensables pour ce poste. De formation supérieure en informatique ou d'une reconversion professionnelle, vous possédez une bonne culture du web frontend et backend.Côté technique, vous êtes à l'aise avec PHP 8, Symfony 6 et avez des notions de NodeJS.Autonomie, ouverture d'esprit et sens du collectif sont des qualités indispensables pour ce poste. Aucune langue attendue Autonomie Esprit d'équipe Voir plus Node.js Minimum 3 ans d’expérience PHP Hypertext Preprocessor Minimum 3 ans d’expérience Voir plus Seyos est un cabinet de recrutement spécialisé dans les métiers de l'IT. Nous intervenons au niveau national et proposons aux candidats des opportunités professionnelles au sein d'éditeurs de logiciels, DSI d'entreprises (clients finaux), startups, acteurs E-commerce. En 9 années d'existence, plus de 1 300 professionnels de l'IT et du Digital ont déjà été recrutés par l'intermédiaire de Seyos au sein de 400 entreprises. Seyos est un cabinet de recrutement spécialisé dans les métiers de l'IT. Nous intervenons au niveau national et proposons aux candidats des opportunités professionnelles au sein d'éditeurs de logiciels, DSI d'entreprises (clients finaux), startups, acteurs E-commerce. En 9 années d'existence, plus de 1 300 professionnels de l'IT et du Digital ont déjà été recrutés par l'intermédiaire de Seyos au sein de 400 entreprises.  Autres offres de l'entreprise  ",apec
Rédacteur, 1  CDI  ,30 - 35 k€ brut annuel,EFREI PARIS,Villejuif - 94,"Rattaché(e) au département Communication & marketing digital et à l'équipe éditoriale, le/la rédacteur(trice) web a pour mission de gérer la production de contenus web afin d'assurer la promotion de l'école et améliorer sa visibilité. Vous serez amené à piloter l'ensemble des productions de contenus internes (site web, emailing, newsletter et externes (partenariats de contenus web et vidéos).Rédaction des emailing et newsletters.Pilotage de la rédaction d'articles avec nos partenaires.Rédaction d'articles pour le site web.Participation aux différents comités éditoriaux.Mises à jour et animation du site de l'école.Réalisation de veilles concurrentielles et être force de propositions créatives.Suivi des performances. Rattaché(e) au département Communication & marketing digital et à l'équipe éditoriale, le/la rédacteur(trice) web a pour mission de gérer la production de contenus web afin d'assurer la promotion de l'école et améliorer sa visibilité. Vous serez amené à piloter l'ensemble des productions de contenus internes (site web, emailing, newsletter et externes (partenariats de contenus web et vidéos).  Rédaction des emailing et newsletters. Pilotage de la rédaction d'articles avec nos partenaires. Rédaction d'articles pour le site web. Participation aux différents comités éditoriaux. Mises à jour et animation du site de l'école. Réalisation de veilles concurrentielles et être force de propositions créatives. Suivi des performances. Diplômé(e) d'une école de journalisme, de commerce ou de communication, vous possédez une première expérience (2 ans environ) en rédaction web ou en gestion de projet SEO.Passionné(e) par l'écriture, vous possédez d'excellentes qualités rédactionnelles et une bonne connaissance SEO, du digital et des réseaux sociaux. Diplômé(e) d'une école de journalisme, de commerce ou de communication, vous possédez une première expérience (2 ans environ) en rédaction web ou en gestion de projet SEO. Passionné(e) par l'écriture, vous possédez d'excellentes qualités rédactionnelles et une bonne connaissance SEO, du digital et des réseaux sociaux. Aucune langue attendue Créativité Force de proposition Voir plus DIgital Minimum 3 ans d’expérience Réseaux sociaux Minimum 3 ans d’expérience Voir plus Grande École du Numérique créée en 1936, l'Efrei est un acteur indépendant majeur de l'enseignement supérieur et de la transformation numérique. Installée à Paris ainsi qu'à Bordeaux, l'Efrei forme 4 600 étudiants dans son programme Grande École d'ingénieurs et dans ses Programmes Experts du numérique (bachelors, mastères?), et propose également une offre de formation continue.Rejoindre l'Efrei, c'est bien plus que rejoindre simplement un leader de l'enseignement supérieur de premier plan, c'est vouloir s'engager dans un projet pédagogique et humain centré sur les étudiants. C'est également l'assurance d'avoir les moyens de ses ambitions tout en vivant dans un cadre professionnel exceptionnel au sein de nos campus.Leader indépendant reconnu d'intérêt public par l'État (EESPIG), l'Efrei est habilitée par la Commission des titres d'ingénieurs (CTI) et fait partie de la Conférence des Grandes Écoles. Depuis janvier 2022, l'Efrei est établissement composante de Paris Panthéon-Assas Université. Grande École du Numérique créée en 1936, l'Efrei est un acteur indépendant majeur de l'enseignement supérieur et de la transformation numérique. Installée à Paris ainsi qu'à Bordeaux, l'Efrei forme 4 600 étudiants dans son programme Grande École d'ingénieurs et dans ses Programmes Experts du numérique (bachelors, mastères?), et propose également une offre de formation continue. Rejoindre l'Efrei, c'est bien plus que rejoindre simplement un leader de l'enseignement supérieur de premier plan, c'est vouloir s'engager dans un projet pédagogique et humain centré sur les étudiants. C'est également l'assurance d'avoir les moyens de ses ambitions tout en vivant dans un cadre professionnel exceptionnel au sein de nos campus. Leader indépendant reconnu d'intérêt public par l'État (EESPIG), l'Efrei est habilitée par la Commission des titres d'ingénieurs (CTI) et fait partie de la Conférence des Grandes Écoles. Depuis janvier 2022, l'Efrei est établissement composante de Paris Panthéon-Assas Université.  Autres offres de l'entreprise  ",apec
Développeur, 1  CDI  ,30 - 36 k€ brut annuel,Valexane,Romans-sur-Isère - 26,"Accompagné par un responsable d’équipe, lui aussi développeur expérimenté, votre quotidien sera rythmé par les phases suivantes : Dès l’évaluation d’un nouveau projet web, les chefs de projets, qui font l’interface avec le client, peuvent vous associer à la réflexion, pour avoir votre regard technique sur le futur développement.  Tous les lundis matin, l’équipe se réunit, pour finaliser le planning de la semaine; vous saurez alors sur quels projets vous travaillerez, et à quels moments.  Votre semaine sera consacrée aux développements en cours, variés et attribués selon vos compétences techniques, avec un fort niveau de confiance; La plupart des projets sont portés en équipe. Le rôle de votre responsable est de vous accompagner sur vos points de blocage, vous assurez à son niveau un reporting régulier de votre activité.  Un projet web, c’est aussi des échanges permanents que vous avez avec l’équipe Front-End pour les intégrations, les chefs de projets et le pôle commercial, vous participez à des réunions de calage en cours de projets.  Les projets web portés ne sont pas du One-Shot, vous êtes amené(e) à effectuer des actions de maintenance sur des sites clients en production.  Accompagné par un responsable d’équipe, lui aussi développeur expérimenté, votre quotidien sera rythmé par les phases suivantes :                     La société Kyxar fait du développement « sur-mesure », parfois en partant from scratch, nous avons nécessairement besoin d’un profil expérimenté avec une bonne maîtrise technique.Vous avez une formation initiale en informatique/développement et tout comme une bonne partie de l’équipe technique, vous êtes venu à ce métier par passion, parfois en autodidacte. Il existe de nombreuses technologies dans le web, nul besoin de toutes les connaître, nous avons besoin de profils maîtrisant PHP, Javascript et MySQL/MariaDB depuis plusieurs années,, c’est un pré-requis important sur ce poste. Côté Frameworks, Kyxar a développé son propre outil, vous serez à l’aise de suite si vous avez déjà travaillé en mode objet sur Laravel ou Symfony.Si vous avez des bases sous Prestashop, ce sera un plus, Kyxar est certifié depuis 2015 et pourra vous accompagner à développer vos compétences sur cet environnement. L’équipe grandit, se structure, il est essentiel que vous ayez travaillé en mode projet et en équipe, sur des outils de type GIT via gitlab, docker, redmine…  Le plus important pour coller à l’état d’esprit de l’équipe : Bon communicant, orienté algorithmes et fonctionnalités, force de proposition et surtout passionné(e).  La société Kyxar fait du développement « sur-mesure », parfois en partant from scratch, nous avons nécessairement besoin d’un profil expérimenté avec une bonne maîtrise technique. Vous avez une formation initiale en informatique/développement et tout comme une bonne partie de l’équipe technique, vous êtes venu à ce métier par passion, parfois en autodidacte.   Il existe de nombreuses technologies dans le web, nul besoin de toutes les connaître, nous avons besoin de profils maîtrisant PHP, Javascript et MySQL/MariaDB depuis plusieurs années,, c’est un pré-requis important sur ce poste.   Côté Frameworks, Kyxar a développé son propre outil, vous serez à l’aise de suite si vous avez déjà travaillé en mode objet sur Laravel ou Symfony. Si vous avez des bases sous Prestashop, ce sera un plus, Kyxar est certifié depuis 2015 et pourra vous accompagner à développer vos compétences sur cet environnement.   L’équipe grandit, se structure, il est essentiel que vous ayez travaillé en mode projet et en équipe, sur des outils de type GIT via gitlab, docker, redmine…     Le plus important pour coller à l’état d’esprit de l’équipe : Bon communicant, orienté algorithmes et fonctionnalités, force de proposition et surtout passionné(e).   Aucune langue attendue Capacité à travailler en mode projet Capacité d'apprentissage Voir plus JavaScript Minimum 5 ans d’expérience MariaDB Minimum 5 ans d’expérience Voir plus Nous représentons KYXAR, une société d’ingénierie web, présente sur la région romanaise depuis 1997.Cette longévité a permis à Kyxar d’avoir une évolution constante de ses compétences internes, et de proposer des solutions web complètes à ses clients.Aujourd’hui à Kyxar, ce sont prêt de 40 personnes, tous passionnés par la technique, et tous orientés sur la recherche des meilleures solutions et applications web, pour des clients très variés. Le périmètre des prestations proposées par l’agence est large et varié : Développement web, solutions E-commerce, applications métiers, Web-design, applications mobiles; le tout accompagné de conseils (optimisation, SEO) et de services connexes (Hébergement, Telecom).  Dans le cadre de projets à venir nous recherchons un(e) développeur back-end H/F qui seraient intéressés pour rejoindre l’équipe.  Nous représentons KYXAR, une société d’ingénierie web, présente sur la région romanaise depuis 1997. Cette longévité a permis à Kyxar d’avoir une évolution constante de ses compétences internes, et de proposer des solutions web complètes à ses clients. Aujourd’hui à Kyxar, ce sont prêt de 40 personnes, tous passionnés par la technique, et tous orientés sur la recherche des meilleures solutions et applications web, pour des clients très variés.   Le périmètre des prestations proposées par l’agence est large et varié : Développement web, solutions E-commerce, applications métiers, Web-design, applications mobiles; le tout accompagné de conseils (optimisation, SEO) et de services connexes (Hébergement, Telecom).     Dans le cadre de projets à venir nous recherchons un(e) développeur back-end H/F qui seraient intéressés pour rejoindre l’équipe.    Autres offres de l'entreprise  Conseils Avantages : Intéressement + tickets restaurants + CE externalisé Avantages : Intéressement + tickets restaurants + CE externalisé ",apec
