title,type_job,salary,compagny,location,description,source
Architecte Big Data, 1  CDI  ,A négocier,TAKOMA,Rueil-Malmaison - 92,"Pour notre client, grand groupe industriel européen spécialiste en électronique, électrotechnique et en automatisme, nous recherchons un Web Architect (F/H). En contact avec les chefs de produit, vous êtes le garant des caractéristiques techniques inhérents aux produits publiés sur le portail du groupe. A ce titre :Vous analysez les données techniques sur les produits (Ampère, Voltage, Puissance );Vous traitez les informations techniques de différents produits d automatisme ou d électronique en accord avec le chef de produit;Vous publiez sur le site du groupe;Vous proposez des solutions techniques sur mesure au chef de produit pour rendre le produit le mieux adapté;Vous travaillez avec les graphistes, les designers, les responsables techniques. Pour notre client, grand groupe industriel européen spécialiste en électronique, électrotechnique et en automatisme, nous recherchons un Web Architect (F/H). En contact avec les chefs de produit, vous êtes le garant des caractéristiques techniques inhérents aux produits publiés sur le portail du groupe. A ce titre : De formation BAC +3/+4/+5 en automatisme, électronique et/ou électrotechnique, vous avez au moins une première expérience professionnelle dans ce secteur. Vous faites preuve d'un esprit analytique, de rigueur et de logique.Vous êtes curieux(se). Vous aimez communiquer sur des sujets techniques. Vous maîtrisez parfaitement les outils bureautiques (en particulier Excel).Vous avez le sens de l'organisation, de l'autonomie et un bon relationnel.Vous parlez couramment Anglais. De formation BAC +3/+4/+5 en automatisme, électronique et/ou électrotechnique, vous avez au moins une première expérience professionnelle dans ce secteur. Vous faites preuve d'un esprit analytique, de rigueur et de logique. Vous êtes curieux(se). Vous aimez communiquer sur des sujets techniques. Vous maîtrisez parfaitement les outils bureautiques (en particulier Excel). Vous avez le sens de l'organisation, de l'autonomie et un bon relationnel. Vous parlez couramment Anglais. Anglais C1/C2 Autonomie Capacité d'analyse Voir plus Bureautique Minimum 10 ans d’expérience Microsoft Excel Minimum 10 ans d’expérience Voir plus Avec ses 200 collaborateurs, TAKOMA est un acteur de référence dans les domaines de la Formation, de la Communication et de l Ingénierie.Parfaite connaissance de l environnement de ses clients, expertise technique, veille permanente et créativité TAKOMA est une entreprise innovante, proposant des prestations et un accompagnement sur mesure :Formation : Digital Learning, On-site training & Blended learning.Communication 360°.Gestion de l information et documentation technique.Conseil en Ingénierie et assistance technique.Entrer chez Takoma, c'est choisir une entreprise à taille humaine, où il est possible d'oser, de proposer mais aussi de découvrir, apprendre, et partager.Pour mieux nous connaître :www.takoma.frwww.welcometothejungle.com/fr/companies/takoma Avec ses 200 collaborateurs, TAKOMA est un acteur de référence dans les domaines de la Formation, de la Communication et de l Ingénierie. Parfaite connaissance de l environnement de ses clients, expertise technique, veille permanente et créativité TAKOMA est une entreprise innovante, proposant des prestations et un accompagnement sur mesure : Entrer chez Takoma, c'est choisir une entreprise à taille humaine, où il est possible d'oser, de proposer mais aussi de découvrir, apprendre, et partager. Pour mieux nous connaître :www.takoma.frwww.welcometothejungle.com/fr/companies/takoma  Autres offres de l'entreprise  Personne en charge du recrutement Sarah KONE - Chargée de recrutement ",apec
Développeur, 1  CDI  ,A négocier,CHU de Poitiers,Poitiers - 86,"Poste proposéRattaché au Responsable du Domaine des Applicatifs, le futur Développeur aura à sa charge le développement de nouveaux modules dans le dossier patient informatisé du CHU. Il sera rattaché à l’équipe de développement, il apportera son expertise technique pour permettre une réécriture de notre dossier patient informatique dans une nouvelle technologie Microsoft. Il coordonnera la réécriture du dossier patient informatisé.- Missions générales-  Les missions principales seront les suivantes :- Réécriture du dossier patient informatisé- Développement de nouveaux modules dans le dossier patient informatisé- Constituer, classer et mettre à disposition les documentations (spécifications techniques, spécifications fonctionnelles, maquettes, …).- Planifier/coordonner les actions de réécriture- Animer des réunions d’équipe- Analyser les besoins des utilisateurs et les formaliser avant de proposer les solutions les mieux adaptées- Participer à la mise en euvre, au test, au paramétrage et au déploiement- - Nature du contrat et des conditions de recrutement- - CDI- Grade : Technicien Supérieur Hospitalier (catégorie B). La rémunération sera fixée en fonction de la formation et de l’expérience des candidats- - Quotité de temps de travail-  Temps pleinIII. Poste proposéRattaché au Responsable du Domaine des Applicatifs, le futur Développeur aura à sa charge le développement de nouveaux modules dans le dossier patient informatisé du CHU. Il sera rattaché à l’équipe de développement, il apportera son expertise technique pour permettre une réécriture de notre dossier patient informatique dans une nouvelle technologie Microsoft. Il coordonnera la réécriture du dossier patient informatisé.- Missions générales-  Les missions principales seront les suivantes :- Réécriture du dossier patient informatisé- Développement de nouveaux modules dans le dossier patient informatisé- Constituer, classer et mettre à disposition les documentations (spécifications techniques, spécifications fonctionnelles, maquettes, …).- Planifier/coordonner les actions de réécriture- Animer des réunions d’équipe- Analyser les besoins des utilisateurs et les formaliser avant de proposer les solutions les mieux adaptées- Participer à la mise en euvre, au test, au paramétrage et au déploiement- - Nature du contrat et des conditions de recrutement- - CDI- Grade : Technicien Supérieur Hospitalier (catégorie B). La rémunération sera fixée en fonction de la formation et de l’expérience des candidats- - Quotité de temps de travail-  Temps pleinIII. Profil recherché- Diplôme et formation requis- - BAC+3 minimum en informatique- Expérience de 5 ans minimum dans le développement Web C#- La connaissance du secteur hospitalier serait un plus- - Compétences et qualités requises- - Compétences techniques- - C#, Framework .NET / .NET Core, Microsoft Visual Studio, Silverlight- HTML 5, CSS 3- JAVASCRIPT dont la maitrise d’au moins un Framework de développement (AngularJS / REACT / VUE JS)- Base de données Oracle, SQL Serveur- La maitrise de Docker et Kubernetes serait un plus- - Qualités requises- - Sens de l’écoute et de la communication (le futur professionnel devra pouvoir communiquer sans problème avec les autres services de la DSI, les Cadres de l’établissement et les fournisseurs)- Esprit de synthèse, esprit d’initiative, disponibilité.- Autonomie  Profil recherché- Diplôme et formation requis- - BAC+3 minimum en informatique- Expérience de 5 ans minimum dans le développement Web C#- La connaissance du secteur hospitalier serait un plus- - Compétences et qualités requises- - Compétences techniques- - C#, Framework .NET / .NET Core, Microsoft Visual Studio, Silverlight- HTML 5, CSS 3- JAVASCRIPT dont la maitrise d’au moins un Framework de développement (AngularJS / REACT / VUE JS)- Base de données Oracle, SQL Serveur- La maitrise de Docker et Kubernetes serait un plus- - Qualités requises- - Sens de l’écoute et de la communication (le futur professionnel devra pouvoir communiquer sans problème avec les autres services de la DSI, les Cadres de l’établissement et les fournisseurs)- Esprit de synthèse, esprit d’initiative, disponibilité.- Autonomie  Aucune langue attendue Autonomie Capacité d’écoute Voir plus Angular JS Minimum 5 ans d’expérience Docker Minimum 5 ans d’expérience Voir plus Développeur Web H/FDirection du Système d’InformationTemps pleinCDIDès que possibleI. Présentation générale du CHUComposé de près 2 700 lits et places, le CHU de Poitiers s’étend sur 5 sites (Poitiers, Châtellerault, Loudun, Lusignan, Montmorillon) répartis sur l’ensemble du territoire de la Vienne.Etablissement de soins de référence à vocation régionale, le CHU de Poitiers assure à la fois une mission de proximité pour les 436 000 habitants de la Vienne et une mission d’appel régional et de recours pour les 1,8 million d’habitants du Poitou-Charentes.Le CHU de Poitiers est organisé en 15 pôles d’activités cliniques et médico-techniques. Avec près de 8 000 professionnels, il constitue le premier employeur de la Vienne.II. Développeur Web H/FDirection du Système d’InformationTemps pleinCDIDès que possibleI. Présentation générale du CHUComposé de près 2 700 lits et places, le CHU de Poitiers s’étend sur 5 sites (Poitiers, Châtellerault, Loudun, Lusignan, Montmorillon) répartis sur l’ensemble du territoire de la Vienne.Etablissement de soins de référence à vocation régionale, le CHU de Poitiers assure à la fois une mission de proximité pour les 436 000 habitants de la Vienne et une mission d’appel régional et de recours pour les 1,8 million d’habitants du Poitou-Charentes.Le CHU de Poitiers est organisé en 15 pôles d’activités cliniques et médico-techniques. Avec près de 8 000 professionnels, il constitue le premier employeur de la Vienne.II.  Autres offres de l'entreprise  ",apec
Rédacteur, 1  CDD  de 18 mois  ,A partir de 23 k€ brut annuel,UNIVERSITE DE CAEN NORMANDIE,Caen - 14,"Missions principales du posteLe poste est placé à la Direction de la communication (DIRCOM) de l université. Ce service central a en charge la stratégie globale de communication de l université. Il est garant de la promotion de l image et de l identité UNICAEN ainsi que de la diffusion des informations. La Direction de la communication élabore et met en œuvre les actions et outils de communication en direction de ses publics, internes comme externes.Pour améliorer la promotion de son offre de formation, l université bénéficie d un financement Normandie-sup de la Région Normandie afin d améliorer la présentation des formations en ligne. La mission de 18 mois consistera principalement à rédiger des contenus pour les catalogues de formations de manière plus communicante et compatible avec les impératifs de référencement.Vous travaillerez au sein du pôle éditorial de la DIRCOM, en lien avec la référente du projet UNIFORMSUP, et en vous inscrivant dans le cadre de la stratégie de com formation élaborée au sein du pôle Communication-événementiel de la DIRCOM. Vous vous appuierez sur les fiches existantes du catalogue en ligne et vous échangerez à chaque fois avec le ou la responsable de diplôme qui validera la version finale mise en ligne. Vous pourrez également rédiger des articles promouvant des formations pour le site web ainsi que les réseaux sociaux. Vous pourrez aussi participer à la rédaction, à la correction ou à la mise à jour de supports print en lien avec l offre de formation.Activités et tâches du posteRéécriture communicante des fiches formation du catalogue en ligne, en lien avec les responsables de diplômes ;Rédaction d articles en ligne promouvant les formations ;Préparation de publications pour les réseaux sociaux, en lien avec la community manager ;Rédaction, correction, mise à jour des supports print en lien avec la formation ;Traduction des contenus en langues étrangères, au moins anglais.Qualité de vie au travailRégime de congés avantageux ;Crèche associative ;Formations à la prise de poste et formations tout au long de la vie professionnelle (Préparations aux concours…) ;Subvention restauration collective (CROUS) ;Forfait mobilité durable (vélo, covoiturage) ou remboursement partiel des frais de transport en commun domicile-travail ;Infrastructures sportives (SUAPS) et de restauration à disposition des personnels ;Action sociale (prestations et aides aux personnels).Conditions de recrutementPoste ouvert aux non fonctionnaires par contrat de projet à durée déterminée, à temps complet.Prise de fonctions dès que possible pour une durée de 18 mois.Rémunération mensuelle brute à partir de 1919.89 € selon l’INM 390 correspondant au 1er échelon de la grille des Ingénieurs d’études. Rémunération appréciée en fonction de l’expérience. Missions principales du posteLe poste est placé à la Direction de la communication (DIRCOM) de l université. Ce service central a en charge la stratégie globale de communication de l université. Il est garant de la promotion de l image et de l identité UNICAEN ainsi que de la diffusion des informations. La Direction de la communication élabore et met en œuvre les actions et outils de communication en direction de ses publics, internes comme externes.Pour améliorer la promotion de son offre de formation, l université bénéficie d un financement Normandie-sup de la Région Normandie afin d améliorer la présentation des formations en ligne. La mission de 18 mois consistera principalement à rédiger des contenus pour les catalogues de formations de manière plus communicante et compatible avec les impératifs de référencement.Vous travaillerez au sein du pôle éditorial de la DIRCOM, en lien avec la référente du projet UNIFORMSUP, et en vous inscrivant dans le cadre de la stratégie de com formation élaborée au sein du pôle Communication-événementiel de la DIRCOM. Vous vous appuierez sur les fiches existantes du catalogue en ligne et vous échangerez à chaque fois avec le ou la responsable de diplôme qui validera la version finale mise en ligne. Vous pourrez également rédiger des articles promouvant des formations pour le site web ainsi que les réseaux sociaux. Vous pourrez aussi participer à la rédaction, à la correction ou à la mise à jour de supports print en lien avec l offre de formation. Activités et tâches du posteRéécriture communicante des fiches formation du catalogue en ligne, en lien avec les responsables de diplômes ;Rédaction d articles en ligne promouvant les formations ;Préparation de publications pour les réseaux sociaux, en lien avec la community manager ;Rédaction, correction, mise à jour des supports print en lien avec la formation ;Traduction des contenus en langues étrangères, au moins anglais. Qualité de vie au travailRégime de congés avantageux ;Crèche associative ;Formations à la prise de poste et formations tout au long de la vie professionnelle (Préparations aux concours…) ;Subvention restauration collective (CROUS) ;Forfait mobilité durable (vélo, covoiturage) ou remboursement partiel des frais de transport en commun domicile-travail ;Infrastructures sportives (SUAPS) et de restauration à disposition des personnels ;Action sociale (prestations et aides aux personnels). Conditions de recrutementPoste ouvert aux non fonctionnaires par contrat de projet à durée déterminée, à temps complet.Prise de fonctions dès que possible pour une durée de 18 mois.Rémunération mensuelle brute à partir de 1919.89 € selon l’INM 390 correspondant au 1er échelon de la grille des Ingénieurs d’études. Rémunération appréciée en fonction de l’expérience. Exigences requisesNiveau requis : Minimum Bac+3 dans des filières telles que Humanités numériques, Lettres, Langues vivantes étrangères, Communication, Journalisme.D autres profils peuvent être étudiés si l expérience est pertinente.Les compétences attenduesMaîtrise de la langue française, des règles orthographiques et de grammaire : rédaction sans fautes ;Maîtrise de la rédaction à des fins promotionnelles : cerner la cible, adapter le vocabulaire, etc ;Maîtrise de la rédaction pour le web et du référencement naturel ;Aisance dans les relations humaines : échanges fréquents avec des interlocuteurs variés (responsables de diplômes) par mail, téléphone et en rendez-vous ;Aisance avec l outil informatique : utilisation quotidienne d une application interne (Uniform-sup : formation prévue), publications régulières d articles sur Wordpress (formation prévue au thème UNICAEN sous Wordpress), publications ponctuelles sur les réseaux sociaux si besoin, en lien avec la community manager ;Maîtrise du Pack Office ;Maitrise de la gestion de projet : plusieurs centaines de fiches à réécrire sur 18 mois ;Les connaissances suivantes seraient un plus :- Capacité de traduction en langue anglaise de bon niveau, autres langues appréciées ;- Sensibilité à l écriture égalitaire (guide UNICAEN de la communication égalitaire) ;Disposer d une excellente maîtrise de la langue française ;Être autonome tout en sachant rendre compte régulièrement de ses avancées et des difficultés rencontrées ;Apprécier le travail en équipe et avoir un bon relationnel ;Grande rigueur, sens de l organisation et aptitude à livrer un projet dans le respect des délais définis. Exigences requisesNiveau requis : Minimum Bac+3 dans des filières telles que Humanités numériques, Lettres, Langues vivantes étrangères, Communication, Journalisme.D autres profils peuvent être étudiés si l expérience est pertinente.Les compétences attenduesMaîtrise de la langue française, des règles orthographiques et de grammaire : rédaction sans fautes ;Maîtrise de la rédaction à des fins promotionnelles : cerner la cible, adapter le vocabulaire, etc ;Maîtrise de la rédaction pour le web et du référencement naturel ;Aisance dans les relations humaines : échanges fréquents avec des interlocuteurs variés (responsables de diplômes) par mail, téléphone et en rendez-vous ;Aisance avec l outil informatique : utilisation quotidienne d une application interne (Uniform-sup : formation prévue), publications régulières d articles sur Wordpress (formation prévue au thème UNICAEN sous Wordpress), publications ponctuelles sur les réseaux sociaux si besoin, en lien avec la community manager ;Maîtrise du Pack Office ;Maitrise de la gestion de projet : plusieurs centaines de fiches à réécrire sur 18 mois ; Les connaissances suivantes seraient un plus :- Capacité de traduction en langue anglaise de bon niveau, autres langues appréciées ;- Sensibilité à l écriture égalitaire (guide UNICAEN de la communication égalitaire) ;Disposer d une excellente maîtrise de la langue française ;Être autonome tout en sachant rendre compte régulièrement de ses avancées et des difficultés rencontrées ;Apprécier le travail en équipe et avoir un bon relationnel ;Grande rigueur, sens de l organisation et aptitude à livrer un projet dans le respect des délais définis. Anglais A1 Français A1 Voir plus Autonomie Capacité d'adaptation Voir plus Bureautique Minimum 1 an d’expérience Communication Minimum 1 an d’expérience Voir plus L’Université de Caen Normandie recrute pour sa direction de la communicationUN(E) REDACTEUR(RICE) WEB  UNICAEN avec ses 33 000 étudiants et ses 2800 personnels, est un acteur majeur et un moteur de développement de l'enseignement supérieur et de la recherche en Normandie. UNICAEN est membre de Normandie Université. ContexteL’université de Caen Normandie – UNICAEN – accueille plus de 30 000 étudiantes et étudiants sur plusieurs campus dans l’agglomération caennaise et en région à Cherbourg-en-Cotentin, Alençon, Lisieux, Saint-Lô, Vire. Notre université profite des atouts de la région Normandie comme le littoral, la proximité du Royaume-Uni ainsi que des accès facilités vers la capitale par train ou autoroute. L’établissement, quant à lui, propose un régime de congés avantageux, une programmation culturelle variée ainsi que de nombreuses activités sportives. L’Université de Caen Normandie recrute pour sa direction de la communicationUN(E) REDACTEUR(RICE) WEB  UNICAEN avec ses 33 000 étudiants et ses 2800 personnels, est un acteur majeur et un moteur de développement de l'enseignement supérieur et de la recherche en Normandie. UNICAEN est membre de Normandie Université.  ContexteL’université de Caen Normandie – UNICAEN – accueille plus de 30 000 étudiantes et étudiants sur plusieurs campus dans l’agglomération caennaise et en région à Cherbourg-en-Cotentin, Alençon, Lisieux, Saint-Lô, Vire. Notre université profite des atouts de la région Normandie comme le littoral, la proximité du Royaume-Uni ainsi que des accès facilités vers la capitale par train ou autoroute. L’établissement, quant à lui, propose un régime de congés avantageux, une programmation culturelle variée ainsi que de nombreuses activités sportives.  Autres offres de l'entreprise  Conseils Modalités de candidatureLes candidats pourront déposer leur dossier complet (CV et lettre de motivation) par mail avant le 24 novembre 2023. Modalités de candidatureLes candidats pourront déposer leur dossier complet (CV et lettre de motivation) par mail avant le 24 novembre 2023. Personne en charge du recrutement Gwendoline MARIE - Gestionnaire RH ",apec
Business analyst, 1  CDI  ,A négocier,KAPA IT,Montpellier - 34,"Vos missions seront : Développement et maintenance du site web : Assurer la création, la mise à jour et la gestion du contenu du site web.Conception web : Créer des maquettes, des mises en page et des éléments graphiques pour le site web.SEO / Optimisation pour les moteurs de recherche : Travailler sur l'amélioration du classement du site dans les résultats des moteurs de recherche.Gestion de contenu : Publier et organiser le contenu (HTML/CSS), y compris du texte, des images, des vidéos, etc.Intégration des médias sociaux : Intégrer des boutons de partage et des flux sociaux pour renforcer la présence en ligne.Suivi et analyse : Utiliser des outils comme Google Analytics pour suivre la performance du site et tirer des conclusions pour l'amélioration. Vos missions seront :   Maîtrise des langages de programmation web : HTML, CSS, JavaScript, etc.Connaissance des systèmes de gestion de contenu (CMS) tels que WordPress, Drupal, Joomla, etc.Compétences en conception web et utilisation d'outils de conception graphique (comme Adobe Photoshop, Illustrator, ou des outils similaires).Compréhension des principes de l'optimisation pour les moteurs de recherche (SEO).Capacité à gérer des bases de données et à travailler avec des systèmes de gestion de base de données (par exemple, MySQL).Connaissance des principes de la sécurité webCompétences en intégration de médias sociaux et gestion de campagnes publicitaires en ligne.Maîtrise des outils d'analyse web tels que Google Analytics. Aucune langue attendue Aucun savoir-être attendu Adobe Illustrator Minimum 1 an d’expérience Adobe Photoshop Minimum 1 an d’expérience Voir plus Kapa IT, ESN présente sur le territoire national, recherche en pré-recrutement au profit d'un de nos clients à dimension internationale Kapa IT, ESN présente sur le territoire national, recherche en pré-recrutement au profit d'un de nos clients à dimension internationale  Autres offres de l'entreprise  Personne en charge du recrutement Laura CONSTANT LAMEIRA - Chargée de recrutement ",apec
