title,type_job,salary,compagny,location,description,source
Intégrateur Web HTML CSS JS - Wordpress / Prestashop,,,Groupe NOIISE,Lyon (69),"Référence de l’offre : INTE/CDI/LYON



 Lyon
 CDI
 Expérience 4 à 6 ans







 Poste et missions


 Description du poste
 Intégré au sein d’une équipe composée d’un intégrateur un chef de projet technique et de deux webdesigners, vous assurez l’intégration des maquettes et la résolution de bugs graphiques en collaboration avec les chefs de projet, en charge de la relation client. Vous serez amené à travailler sur plusieurs typologies de sites web (vitrine/e-commerce), principalement WordPress/Prestashop.










 Missions principales






 CMS
 Excellente connaissance du CMS WordPress et de son écosystème






 Intégration
 Être capable d’intégrer un thème from scratch sans thème parent ni outils de conception visuelle et via des outils comme Elementor et DIVI ou Visual Composer…






 SEO
 Intégration des recommandations techniques fournies par les consultants SEO.










 Languages
 Très bonnes connaissances des langages HTML5, CSS et SCSS






 UX / UI 
 Bonne sensibilité graphique, notions d’ergonomie et UI/UX






 Performance
 Notions des bonnes pratiques de développement liées à la performance web.










 E-commerce
 De bonnes connaissances de Prestashop (1.6, 1.7 et 1.8).






 Content 
 Avoir l’habitude des missions de Webmastering














 Profil recherché






 Savoir-être

 Vous savez travailler en autonomie, mais vous avez aussi un bon esprit d’équipe.
 Vous êtes curieux(-se), passionné(e), et vous aimez surmonter des défis techniques pour trouver LA solution qui convient à vos clients et vos projets.
 Ambitieux ; Vous avez le goût du challenge et aimez pousser les limites de l’intégration front.. On tente le CSS Awards ?!
 Vous avez soif d’apprendre ; nous avons une équipe technique de plus en plus capée avec des process de fonctionnement agile. L’enseignement est la clé !







 Savoir-faire

 Vous avez une expérience de 4 ans minimum sur le même type de poste en agence ou chez l’annonceur.
 Vous utilisez les outils web et de création (Suite Adobe, Visuel studio, Filezilla…)
 Vous maîtrisez au moins un CMS, et les langages HTML/CSS, ainsi que les outils de construction Divi / Elementor / Visual Composer
















 Travailler chez NOIISE
 NOIISE est une Agence Digitale spécialisée dans l’acquisition de trafic. Nous mettons en œuvre pour nos clients, des stratégies de visibilité via des leviers tels que le référencement naturel, les campagnes PPC ou les places de marché.
 L’agence compte à ce jour 75 collaborateurs répartis dans nos 6 antennes régionales de Lille, Nantes, Paris, Marseille, Aix-les-Bains et Lyon.
 Nous intervenons principalement pour PME, ETI et des grands groupes, sur des secteurs concurrentiels tels que : Retail, Décoration et mobilier, Mutuelle et santé, e-Tourisme… Soit plus de 500 projets menés depuis 2007.
 NOIISE est aussi Google Partner Premier, ce qui signifie que nous faisons partie des meilleures agences agréées Google AdWords.",indeed
Développeur PHP junior – Lyon - CDI,,,AXOPEN,"235 Cours Lafayette, 69006 Lyon","Hello ! Tu recherches un job de développement PHP ? L'informatique te passionne ? Tu as envie de travailler dans un environnement composé exclusivement de développeurs et développeuses, et de ne pas être en mission régie chez les clients ? Tu es au bon endroit : bienvenue chez AXOPEN !
Axo Quoi ?
AXOPEN, c'est une boite d’informatique à taille humaine située à Lyon !
Notre job, c’est de réaliser des projets informatiques pour nos clients, essentiellement des développements d’applications web et mobiles sur-mesure. D’ailleurs, tu connais sûrement certains d’entre eux : EDF, Sport dans la Ville, ekWateur, Handicap.fr, etc.
Aujourd’hui, l’équipe est composée d’une 50aine de techs passionnés, qui adorent se challenger, et partager leurs bonnes pratiques et leurs expérimentations techniques ! Pour compléter cette team, on recherche justement quelqu’un de passionné, qui adore coder, et qui a envie de travailler avec nous sur des projets innovants :)
Tes missions
Concrètement, c'est de développer des applications web avec PHP et le framework Symfony, et en front, des technologies JavaScript comme Angular, VueJS et React !
Au sein d’une équipe composée d’un lead tech et de 2 à 5 développeurs, tu participeras au développement de projets en PHP/Symfony, et réaliseras des développements d’écrans, de fonctionnalités et de webservices dans des contextes variés et super intéressants !
Selon tes compétences et tes envies, tu pourras également développer des applis avec d'autres technos comme Java, Spring Boot, .NET, etc.
Ton profil

Tu as un BAC +2/BAC+3 en informatique (DUT/BTS/licence)
Tu es autonome, touche-à-tout et curieux
Les langages évoluent et toi aussi !
Tu es toujours à l’affût des news du secteur !
Le développement pour toi, c’est bien plus qu’un métier, c’est une véritable passion !

Précision d’importance : tu n'as pas besoin d'être un expert PHP pour postuler ! Si tu l'es, c'est bien, mais si tu es débutant et passionné, ça marche aussi !
L'essentiel pour nous, c'est que tu aies envie d'apprendre et de coder
Dans le cadre de notre politique RSE, AXOPEN étudie et s'engage à valoriser la diversité des profils de ses collaborateurs à compétences égales.
Ton environnement

Tu ne seras pas envoyé(e) en mission chez un client ! Tu passeras la quasi-totalité de ton temps chez AXOPEN, en mode projet AGILE
Tu seras intégré(e) au sein d’une team de développeurs & experts techs, pratique pour l’entraide !
En intégrant AXOPEN, tu bénéficieras d'un véritable accompagnement tout au long de ta carrière, de formations internes et certifications et d'un système de parrainage technique
Ta vie privée sera respectée : parce que c’est essentiel pour nous de différencier vie pro et vie perso, on a mis en place une charte de déconnexion pour ne pas être sollicité en dehors des horaires de travail
Bien plus qu’un boulot, c’est un quotidien : des activités sportives, des afterworks, des jeux, des projets internes : celui du moment est la construction d’une borne d’arcade… Bref, un environnement décontracté où on continue à apprendre tous les jours !

Package & autres infos

Salaire en fonction du parcours
Carte Swile Tickets Restaurant
Télétravail partiel possible jusqu’à 2 jours par semaine
Prime d'intéressement (en fonction des résultats annuels)
Bonne mutuelle !
Prise en charge à 100% de l'abonnement TCL (transports communs lyonnais) et Vélo'v
Localisation : chez AXOPEN, dans un cadre agréable (tu travailles pour nos clients, PAS chez nos clients). Nos locaux sont situés dans le quartier de Part-Dieu, idéal pour l’accessibilité !
Prise en charge de la totalité des évènements par l’entreprise (séminaires, sorties de sport mensuelles, afterworks, etc.)

Pour candidater
Si tu te reconnais dans l’offre, on sera ravis de découvrir ton profil ! Pour postuler, partage-nous ton CV, tes motivations, ton Git et quelques projets personnels si tu en as :) Par mail sur recrutement[a]axopen.com ou via notre site https://www.axopen.com/jobs/ !
Pour que tu saches dans quoi tu t’embarques en postulant, voilà notre  processus de recrutement :

1er entretien : Une visio pour découvrir ton parcours, échanger sur tes motivations et répondre à tes questions sur AXOPEN
2ème entretien : Une rencontre avec un expert technique chez AXOPEN pour parler tech, coder quelques lignes et découvrir nos locaux !

À bientôt !
Type d'emploi : CDI, Temps plein
Salaire : 27 000,00€ à 34 000,00€ par an
Avantages :

Épargne salariale
Prise en charge du transport quotidien
Titre-restaurant

Programmation :

Du lundi au vendredi
Travail en journée

Types de primes et de gratifications :

Primes

Lieu du poste : Télétravail hybride (69006 Lyon)",indeed
Développeur Front-End H/F,,,NET SQUARE DIGITAL,Télétravail,"Nous recherchons un développeur Front-End (H/F) talentueux pour rejoindre notre équipe. En tant que développeur Front-End, vous serez responsable de la création d'interfaces utilisateur attrayantes et fonctionnelles pour nos applications web. Vous travaillerez en étroite collaboration avec notre équipe de développement pour concevoir et mettre en œuvre des solutions innovantes.
Responsabilités :- Développer des interfaces utilisateur interactives en utilisant les dernières technologies web- Collaborer avec l'équipe de conception pour créer des expériences utilisateur intuitives- Optimiser les performances et la vitesse des applications web- Assurer la compatibilité multi-navigateurs et multi-appareils- Participer à la planification et à l'estimation des projets
Expérience requise :- Book avec projets visibles.
Nous offrons un environnement de travail dynamique et stimulant, où vous aurez l'opportunité de travailler sur des projets passionnants. Nous encourageons également le développement professionnel continu et offrons des opportunités d'avancement.
Si vous êtes passionné par le développement Front-End et que vous souhaitez rejoindre une équipe talentueuse, nous serions ravis de discuter avec vous. Postulez dès maintenant pour rejoindre notre équipe en pleine croissance !
Veuillez noter que seuls les candidats sélectionnés seront contactés pour une entrevue.
Type d'emploi : Alternance
Salaire : à partir de 700,00€ par mois
Programmation :

Travail en journée

Lieu du poste : Télétravail",indeed
Chargé.e web et réseaux sociaux,,,Soitec,38190 Bernin,"Introduce Soitec and context of the position: 
 
   Soitec est une société cotée dans l’indice SBF 120 qui intervient en amont de la chaîne de valeur de la microélectronique. Nos matériaux semi-conducteurs innovants sont indispensables au fonctionnement des smartphones et au déploiement de la 5G. Ils offrent également de nombreuses opportunités pour l’automobile connectée, les véhicules électriques et autonomes et l’intelligence embarquée dans les objets connectés.
 

   Cette place nous confère une incroyable responsabilité, qui nous inspire au quotidien : rendre possible l’adoption massive d’innovations technologiques tout en limitant considérablement leur impact environnemental, dans une logique d’innovation responsable et de développement durable.
  What does the job consist?: 
 
 Le contexte du poste



 Afin de supporter la forte croissance de l’entreprise, l’équipe Communication s’agrandit. Cette équipe est en charge de toutes les fonctions de Communication Interne, externe et marketing communications: campagnes marketings, événementielles, création graphique, support de la charte graphique, prise de parole lors de conférences, marketing digital (webinar, brochure, site internet, réseaux sociaux, génération de leads), publication d’articles pour la presse spécialisée.
 


 Sous la responsabilité de Jérôme, Responsable du pôle Marketing Communication, vous aurez en charge la gestion du site internet, des réseaux sociaux et de la publication de la newsletter mensuelle.
 


 En quoi consiste le poste ?



 En étroite collaboration avec le responsable Marketing Communication et la responsable de Communication externe vous travaillerez à mettre à jour le site internet de Soitec en utilisant le content management system, vous gérez le calendrier éditorial ainsi que les publications sur les différents réseaux sociaux (LinkedIN, Twitter, Instagram, WeChat). Vous travaillerez à la création, rédaction et à l’envoi de la newsletter mensuelle de Soitec.
 


 Vous vérifierez que les postes sur les réseaux sociaux sont entièrement alignés avec la stratégie de l’équipe Communication, qu’ils renforcent l’image de marque de Soitec et que le contenu est livré correctement aux clients ciblés.
 


 Votre rôle sera notamment :
 



 Créer et mettre en œuvre des stratégies de médias sociaux pour promouvoir la marque Soitec et augmenter la visibilité de notre entreprise
 Créer du contenu pour les plateformes de médias sociaux (Facebook, Twitter, LinkedIn, Instagram, etc.) et gérer le calendrier éditorial
 Analyser les données des médias sociaux et les tendances pour améliorer la stratégie de contenu tout en faisant augmenter nos followers
 Assurer une veille constante sur les tendances et les évolutions dans le monde des médias sociaux
 Faire des recommandations pour de la sponsorisation des postes pour développer plus d’engagements
 Gérer la création et la publication de la newsletter de Soitec tous les mois: recherche de thématiques, rédaction d’articles, recherche d’illustrations
 Travailler sur la mise à jour du site internet de Soitec par le content management system en collaborer avec les différentes divisions qui ont besoin d’avoir du contenu publié
 Analyser les données du site internet en utilisant Google Analytics
 Assurer la bonne optimisation et le bon réferencement des pages publiées en utilisant les dernières techniques de search engine optimization



 Au-delà de votre périmètre et dans un souci d’optimisation et d’efficacité, vous êtes amenés à proposer et contribuer aux évolutions des processus et outils de l’équipe Communication
 


 Dans un environnement de haute technologie, vous serez plongé.e au cœur des enjeux d’innovation de Soitec !
  Requirements & qualifications:
 

 Au moins 5+ années d'expérience en tant que Social Media Manager ou dans un poste similaire pour une grande entreprise en France ou à l’international.
 


 Une excellente compréhension des différentes plateformes de médias sociaux et de leur fonctionnement.
 


 Une forte capacité à créer et à éditer du contenu pour les réseaux sociaux
 


 Une grande compétence en analyse de données et en mesure des performances des campagnes publicitaires (Google analytics ou autre système)
 


 Une capacité à travailler en équipe et à collaborer avec des personnes de différents domaines d'expertise
 


 Une connaissance des outils de gestion de médias sociaux (Buffer, Hootsuite, Sprinklr, Sprout Social…)
 


 Une excellente compétence en communication écrite et orale en français et en anglais",indeed
Rédacteur web SEO - Secteur décoration/ameublement haut de gamme (IT) / Freelance,,,FREELANCE.COM,Paris (75),"Notre client dans le secteur de l?aménagement et la décoration haut de gamme, recherche un rédacteur SEO pour une dizaine d?articles pour leur blog, afin de positionner leur site au mieux. 
Thèmes de l?agencement d?intérieur et de la décoration. Quelqu?un avec un style plutôt haut de gamme et des connaissance du secteur déco/aménagement/architecture ou des expériences passées. 

 Full remote 
Démarrage ASAP",indeed
Développeur site vitrine Wordpress (IT) / Freelance,,,Coexya,Lyon (69),"Construction du site web vitrine 
Concevoir, développer, tester et documenter les fonctionnalités de la plateforme sur Wordpress
Rendre le site web esthétiquement attrayant, mais aussi hautement fonctionnel, flexible et prêt à prendre en charge des liens de redirection à l?avenir pour la gestion de compte ainsi que la consommation et la visualisation de nos produits
La mission du développeur consistera à faire partie de l?équipe technique en charge du développement de cette plateforme

 Profil candidat:
 

Bac +3/5 en informatique/ingénieur 
Expérience de développement Wordpress vérifiables sur plusieurs réalisations différentes (au moins 2) dans un contexte professionnel
Expérience développement de site multilingue WordPress et plug in associé (Polylang, WPML..)
Bonne connaissance du CMS WordPress et langages de programmation correspondants (HTML, CSS, PHP et JavaScript) et utilisation de la dernière version stable WP.",indeed
RESPONSABLE ADJOINT SERVICE WEB F/H,,,Groupe Cargo,"8 Avenue Saint Granier, 31300 Toulouse","Holding d’un groupe toulousain d’une trentaine de sociétés (+ de 500M€ de CA, 2.800 personnes), leader sur son marché, spécialisé dans l’import, le négoce et la distribution de produits non alimentaires auprès des différents réseaux de distribution.
Pour accompagner notre croissance, nous vous proposons d’intégrer une structure dynamique dans un cadre de travail agréable en qualité de :
RESPONSABLE ADJOINT SERVICE WEB F/H
Missions :
Sous la responsabilité du Responsable e-commerce, rattaché(e) au service de la DSI du groupe Cargo, vous aurez une vision macro du portefeuille de projets. Supervisant l'équipe de chefs de projet, vous assurez le suivi des projets du groupe : sites e-commerce, sites institutionnels, applications internes, vous aurez un éventail large à gérer.
Vos missions seront les suivantes :
La responsabilité et la gestion des plannings de l'équipe et de la roadmap globale :

Construction, suivi, ajustement de la roadmap projets


Gestion des charges, des priorités de l'équipe.


Gestion des risques projets (retard, charges…)

Le suivi et le management d'équipe :

Management de l'équipe projet : gestion des ressources, recrutement, entretien…


Suivi planning de l'équipe développement avec l’aide de l'équipe projet


Suivi performances et besoins de l'équipe avec le responsable de service

La gestion et le suivi des projets :

Spécifications, tests, validation des projets du service avec l’aide de l'équipe projet


Gestion des besoins et des projets filiales (15 filiales) et internes


Suivi des indicateurs business, reporting et communication avec les filiales


Gestion et participation à des projets multi-services / multi-filiales / inter-service et groupe


Mise en place avec l'équipe de process, méthode de travail, documentations, cadre projet (…)


Suivi, mise en place des outils de gestion des plannings et de gestion des projets


Création, validation et application des process projets interne et inter-services DSI.

Profil :

5-10 ans minimum dans la gestion de projet (gestion de projet web serait un atout)


Expérience significative dans le management et la gestion de projet


Expérience dans le “multi-projets” - gestion de plusieurs projets en mm temps


Connaissances techniques web


Connaissances des outils du service (CMS Magento, CMS Drupal, outils de gestion de planning, Gantt…)

Personnalité :

Affirmé(e), capable de prendre le lead sur des sujets face à plusieurs responsables de service, capable de prendre les sujets en main et qui n’a pas peur d’exprimer sa vision


Personne qui sait gérer le stress et la charge de travail


Personne empathique, à l'écoute des équipes et des besoins


Personne qui est force de proposition dans la mise en place d’organisation et process


Personne capable de se projeter et qui va pleinement s’impliquer dans la “directive” groupe pour créer de l’unité au sein du service.


Personne à l’aise à l’oral pour driver des réunions

Type d'emploi : CDIStatut : Cadre
Avantages :

Aide au déménagement
Crèche d'entreprise
RTT

Programmation :

Travail en journée

Types de primes et de gratifications :

Primes

Lieu du poste : En présentiel",indeed
Attaché(e) commercial(e) e-commerce,,,123bain,"2 Chemin Du Génie, 69200 Vénissieux","NESSBY est une petite entreprise située à 69200 Vénissieux. Notre société est spécialisé dans la fourniture d'équipements de salle de bain aux style tendances et design essentiellement via le E-commerce
Nous portons haut et fort nos valeurs, le conseil, la qualité au juste prix, le design et le service, auxquelles nous attachons tant d’importance.
Nous recherchons des personnes qui ont démontré des résultats tangibles et qui ont un bon sens de l'organisation. Ce candidat doit posséder une connaissance approfondie de l'ensemble de la chaîne de valeur, des technologies informatiques, de ventes par Internet, du marketing multicanal et e-commerce international.
Responsabilités :

Gestion d’un portefeuille client BtoB (du prospect à la facturation)
Les fondamentaux de la relation client (renseigner, accompagner, fidéliser )
Maîtriser la relation client par téléphone
Rédaction de mails d’approches et scénario en fonction de la cible
Organiser efficacement la prospection commerciale digitale
MAJ des données CRM & planification de rdv (calendly)
Gestion des demandes SAV en relation avec les fournisseurs
Suivi des KPI’s et reportings réguliers
Mesure de la satisfaction client

Aisance à l'oral comme à l'écrit, à l'aise avec les outils informatiques.
Maitrise obligatoire du pack office (word, excel, powerpoint, drive)
Type d'emploi : Temps plein, Alternance
Salaire : 900,00€ à 1 500,00€ par mois
Environnement de travail :

Bureau
En présentiel
Lieu de Travail Unique

Programmation :

Du lundi au vendredi
Période de travail de 8 Heures
Travail en journée

Lieu du poste : En présentiel",indeed
